No.	Text	Valence_Mean	Arousal_Mean	Valence_SD	Arousal_SD	Category
2794	一名蔡姓男子，因為前女友和現任女友之間有嫌隙，雙方派人相約談判，過程中一言不合，竟然就拿出刀棍當街亂鬥，三人被砍傷送醫。	3.000	5.300	0.707	1.187	news
1572	法國在過去兩週來對馬利北部的AQIM發動懲罰性空襲，AQIM是否有時間來策劃新一輪恐怖攻擊仍是未知數。	4.000	3.625	0.816	1.409	political
565	感到特別安全。	6.375	4.571	0.857	0.904	hotel
548	補充點評2008年4月15日：建議大家到日照時選擇其他酒店，祝大家在日照開心.	6.000	3.833	0.816	0.898	hotel
2023	Youtube主播Madmorda用Wii的主機板自己製作了一臺迷你NGC主機，可以真正實現遊戲功能。	6.125	3.778	0.331	1.812	news
696	您在入住酒店期間有不愉快的經歷，我們非常抱歉。	4.000	5.500	0.707	0.5	hotel
1811	先是破壞立法院再破壞行政院，然後喊革命，暴動被鎮壓就喊員警打人反對暴力；啊自己用暴力時就覺得自己很對很理性，被公權力鎮壓就說政府是野蠻人，真是快笑死人了LOL，有哪個國家的革命家還會不要臉得喊員警打人的？沒有當場槍斃內亂罪現行犯已經是非常仁慈了，有看過悲慘世界2012版)的應該都知道，革命失敗的下場可是當場就槍決的。	3.125	7.000	0.781	0.756	political
2315	先前也謠傳光陽可能會在近期發表較大功率、且Ionex電池比當前更大的電動車，或許此次的活動也將為傳聞中的光陽較大功率電動車的發表活動也不一定。	5.778	5.250	0.786	1.479	news
1181	家長在市場擺攤，工作很忙，小孩就放牛吃草，父母用錢打發小孩，有求必應，卻缺乏親情互動。	3.333	2.800	0.816	0.4	news
1230	如果自己是未成年學生，覺得要面對這些事情有些麻煩，真的不想要面對與處理這些問題，請男方不要當「小孬孬」，好好戴上套。	3.556	6.333	0.956	1.155	news
368	也不喜歡Toyota的設計和調性...所以我並不覺得Toyota很強大!	3.375	5.750	0.484	0.661	car
2017	她多謝媽媽眠乾睡濕照料，出院後調理身子要吃什麼就聽從媽媽吩咐，又感謝醫院醫護人員照顧、各方好友及聖心師妹們的關懷問候。	6.889	4.125	0.875	1.452	news
4	但我相信它會和我手中的這本書一樣溫馨美好。	6.375	5.143	0.484	0.833	book
219	我不希望大家都迷失在永無習日的數字遊戲中！	3.714	5.625	0.452	1.111	book
485	說白了只是各取最適合自己的車罷了我這樣也算正名嗎?	4.111	4.889	0.737	0.994	car
2734	警方指出，3位民眾疑似因拍照問題小孩打架引發大人爭吵，雖未影響小哥演出，但周遭觀眾被喧鬧聲驚擾影響，經工作人員處理下決定請員警處理。	3.400	5.556	0.49	1.066	news
2542	一名39歲的胡姓男子，疑似和65歲的父親發生衝突，一氣之下竟狂刺對方20刀致死，伴屍3天等到屍體發臭，再將其簡單包裹並載到溪洲橋下水圳棄屍。	2.000	7.000	0.775	0.866	news
1923	外交部今天表示，美國遭颶風侵襲，災區又受風雪襲擊，將捐130萬美元賑災；美國在臺協會（AIT）說，感謝臺灣慷慨捐助。	6.625	4.667	0.857	0.471	political
1436	兩人愛情趨向穩定，情變機率小。	5.667	3.875	0.667	1.053	news
1299	「英雄聯盟」遊戲去年首度舉辦世界錦標賽，總獎金高達二百萬美元，目前全球有數千萬玩家，臺灣也有上百萬玩家，主要是大學生，號稱每十個大學生就有一個玩過英雄聯盟。	5.667	5.286	0.816	0.7	news
1348	網友曾育暖表示，不能說心疼包子就代表主人沒錯...我想你們會希望自己痛苦的時候還有人一直在後面要求你握手甚至站起來嗎？；網友NanaSun說，天阿哭慘了...說包子生病了還是想撒嬌，你怎麼知道他是不是在求救？！	3.667	5.750	1.155	0.968	news
1489	臺北京站廣場同步收看直播的玩家緊盯螢幕，不時發出歡呼聲並拍手叫好，直呼：「好緊張！	6.375	5.625	1.111	1.996	news
2840	四月30日晚上十點左右，北屯區太原路發生一起交通事故，機車騎士即興轉彎，導致後方機車摔倒受傷，肇事騎士自稱行車中耳機聽音樂，所	3.333	4.000	0.667	1.563	news
2858	這是一支奇特的隊伍，他們整齊劃一乘車而來，顯得紀律嚴明、訓練有素，但他們乘坐的車輛卻是五花八門，有卡車、麵包車、拖斗車，甚至還有當地的警車。	5.375	4.333	0.484	1.247	news
342	是有一些不爽為什麼不撞我的舊車卻偏偏撞我的新車。	3.125	6.375	0.599	1.495	car
632	是商務旅行的理想選擇。	6.375	3.111	0.484	1.197	hotel
766	酒店大堂秩序比較亂。	3.556	4.200	0.497	0.748	hotel
205	我從很小的時候就非常喜歡讀書獨獨不喜歡歷史方面的書籍感覺她們太沉重，中國的歷史太讓我們這些赤子而憂心重重了	3.667	3.000	0.667	0.816	book
1044	而造成永難彌補的遺憾，竟是闖紅燈的民間救護車。	3.222	4.714	0.629	1.385	news
2453	本次升級主要是聊天訊息可多選後逐條轉發及合併轉發，聊天表情可多端漫遊，支援設定好友訊息免打擾，圖片檢視器優化升級。	6.444	3.556	0.956	1.95	news
642	不過也有好的方面：最近一次入住長話免費打，雖然我幾乎不打；早餐不貴，而且很多健康食品。	5.667	3.143	0.943	0.833	hotel
924	ubuntu系統應該更好，待嘗試	6.000	3.714	0.943	1.161	laptop
1813	我反對死刑的原因很簡單：就是無法降低犯罪率.	4.333	5.000	0.816	0.816	political
670	歡迎您再次入住，衷心祝您身體健康，工作順利!	6.714	4.167	0.452	0.898	hotel
2772	報導說，下個星期也不會出現好訊息，因為4月份的貿易赤字可能進一步擴大，消費者信心可能下降，家庭消費可能不溫不火。	3.333	5.375	0.667	1.111	news
406	這安全問題很像騎機車裡也常發生~安全帽與護具問題~戴全罩好還是瓜皮好~要穿護具不穿護具每個人都有自己答案~之前朋友也是大概這樣講~我慢慢騎就好沒必要戴全罩穿什護具笑死人~反正每人注重的點不一樣~有人會買就是會買~就顧好自己就好~重點只要遇過一次就知道有那些安全配備的好反正很多都是要花錢買經驗體驗就知道~	4.667	4.143	0.943	0.639	car
2859	民意直直下落的蔡英文愈詭辯妄言，愈暴露內心虛弱，一句執政者必須忍受孤獨，道出了這個孤獨政客在權力黃昏之際的心聲。	4.000	2.875	0.866	1.269	news
328	這是為了讓普通男孩、女孩有幻想的空間。	5.333	4.571	0.471	0.728	car
2008	當反同勢力不讓性平教育進入校園，學生已經自主吹起性別平等的風，舉辦板中男裙週、臺大男裙日，希望促成改變，共創性別友善的校園。	6.714	5.000	0.452	1.512	news
2823	桃園一名鍾姓男子穿著刑警背心，還配戴BB槍跟無線電，長期在釣蝦場裡滋事擾民，結果來了個真員警當場被識破，他邊發抖一邊辯稱只是在玩角色扮演！	3.857	4.667	0.833	1.247	news
1446	陳其邁指出，陸委會雖兩度發函給中國海協會表示抗議，也委託海基會董事長林中森當面向海協會長陳雲林表態，但對方先是以「趕時髦」敷衍，還正式回函說「抗議不成立」，顯示中國對臺灣的傲慢心態從未改變，儘管馬英九誇稱兩岸關係大躍進，中國依然是「誰理你們」。	3.375	5.571	0.696	1.178	news
2966	澳洲聯邦員警表示，警方在今天稍早搜索了澳洲廣播公司集團位於雪梨的總部，並鎖定3名參與兩年前一份調查報導的記者。	5.000	2.714	0.707	1.578	news
1843	推薦給每一個希望自己獨立和清醒的人。	5.667	4.125	0.471	0.927	political
1764	中國日報報導，政府控制的上海復旦大學國際研究中心教授沈丁立表示，黑格是位好的人選，「反對伊拉克戰爭」，是位「溫和且可敬的共和黨員」。	5.500	4.333	0.5	0.745	political
375	你果然沒常上01做功課，之前才有一篇專門討論天窗的優缺點的文章，其實車子這種東西，要買之前我都會考慮配備未來的加裝性...比如說，假設今天我不確定要不要買有天窗的車，那我會先加錢先買有天窗的車，原因很簡單，萬一買了車後，想要有天窗，我也不會後悔，但是萬一我沒買有天窗的車，以後有錢也加裝不了，但是萬一我不喜歡天窗，那也沒差，反正就把天窗隔板拉上，在車內看起來一樣跟沒天窗的車一樣...	4.000	5.625	0.0	1.111	car
988	有外接顯示屏的介面，SD插槽對我來說很有用。	5.875	4.000	0.927	0.756	laptop
1262	「卡內」是一隻5歲多的柯基犬，主人卡內拔經常替他拍照，而卡內麻就負責在BLOG撰文，分享帶狗兒子吃喝玩樂的生活點滴。	5.667	3.375	0.816	0.992	news
1469	最關心就是經濟，他要向大家報告，衰退了1年的世界經濟，已經慢慢露出復甦曙光，臺灣景氣也從去年第4季開始緩緩好轉。	6.600	5.714	0.49	0.452	news
1418	引發朝野關切電競選手未來，行政院長陳沖15日表示，經濟部可比照優秀體育選手服替代役方式來研擬。	5.250	3.143	0.433	0.99	news
1277	警方調查，吳宗憲等人昨天清晨五時許，到南京東路五段陳家涼麵用餐，因鄰桌三男兩女講話太大聲，引起吳宗憲的不滿，於是要其中一人到店外詢問究竟談些什麼？對方向吳表達不好意思，願意替吳宗憲等人埋單，以示歉意。	3.875	3.000	1.166	1.0	news
1800	黨報強力回擊，透露出總書記習近平主導強勢外交的味道。	5.286	4.429	0.452	0.904	political
254	明明是個比何適好一百倍的男人，明明是個比何適更加適合她的男人，步懷宇，讓人覺得可以依靠的成熟男人。	6.625	4.000	0.696	0.894	book
1848	能想像首都市長挺一個貪汙貪腐搞爛台灣還死不認錯的陳水扁?	2.714	6.143	0.452	0.833	political
785	"對客房服務員要進行培訓，當客人房門門鎖上掛了""請勿打擾""的字樣，希望不要再擅自進入客房，這是對客人的尊重."	4.889	5.000	0.994	1.118	hotel
1276	吳宗憲表示，對方提告，自己也會提告，他自認傷勢很嚴重，昨傍晚依舊搭機赴芝加哥表演，強調這不是落跑，並坦承當晚喝酒，但酒品和ＥＱ都很好，起衝突是他誤認對方是「狗仔」，「我會透過管道約他們出來聊聊，當面跟他們道歉」。	4.222	4.857	1.133	0.833	news
2854	57歲的潘兆初現時是高等法院上訴法庭法官，林鄭月娥讚揚潘兆初具備高度才能，為官持正不阿，在司法機構及法律界深得敬重，處理民事和刑事上訴的經驗均甚為豐富。	6.111	3.222	0.737	1.548	news
839	介面充足，3個USB，1個讀卡器，外加LAN和顯示器介面，滿足基本的外設需求。	5.500	3.500	0.5	1.025	laptop
1137	立委會質疑官員心態落後，是拿世界主要電玩大賽做借鏡，臺北暗殺星參與的美國英雄聯盟第二季比賽，史上獎金最高，美金100萬，摺合臺北2900多萬，但光是英雄聯盟這款遊戲創造的產值，就超過10億。	5.250	5.571	0.829	1.05	news
2829	她是電影票房皇后，歌唱巨星，甜美、清新、純真、善良、渾身散發快樂，桃樂絲黛具備美國人嚮往的所有特質，但是在真實人生中，她歷盡滄桑。	4.286	3.667	1.161	0.943	news
2792	民主黨籍的司法委員會主席納德勒表示，給巴爾多兩日時間改變主意，又要求他向國會公開完整的通俄調查報告，否則會視巴爾藐視國會。	4.000	4.714	0.0	1.278	news
986	光驅：讀盤能力強，用來放D版碟都沒問題.	6.375	5.500	0.484	0.707	laptop
1408	第八屆「烏克蘭國際發明展」昨天公佈得獎名單，臺灣代表隊九十七件參賽作品，就獲得五十面金牌、三十三面銀牌、七面銅牌，中獎率超過九成，得獎數較去年多一倍，在所有參賽國中表現最佳。	6.875	5.333	0.781	1.247	news
278	它喚醒了我心靈深處的記憶，讓再一次體會學習和成長的快樂。	7.000	5.143	0.0	0.833	book
904	品牌價格低，配置也均衡，xp很容易裝，跟普通裝電腦沒兩量，給後來買的朋友一點建議吧，用深度的xp，按F2進入bois	5.222	4.625	0.629	0.992	laptop
2224	Google一如所有的爆料所道，為這產品線帶來兩名定價較親民的新成員，只要400美元的Pixel3a和480美元的Pixel3aXL。	6.500	5.000	0.5	1.512	news
1083	錢、債務煩惱、煩惱單親父母因照顧家而累壞了，經濟壓力對單親子女造成不少的陰影。	2.571	4.000	0.495	1.155	news
1110	職棒如果沒有了，對基層的球員影響相當大，期許能將棒球以前的光榮再找回來。	5.111	4.143	0.567	1.245	news
578	月壇北街上的護國寺小吃我也老喜歡的。	6.000	4.571	0.816	0.904	hotel
2345	筆身立體浮雕，畫面栩栩如生~提起施耐德，腦中出現的應該是電氣開關，但如果身邊有熟悉的德國友人，施耐德就是比較常見的書寫工具了。	5.286	3.250	0.452	2.046	news
761	比起其它省市的如家差得太遠了，很失望。	3.000	4.833	0.0	0.687	hotel
2517	卡通帆布包，土酷嘻哈~淘寶精選當前售價35元，現可領取5元優惠券，實付到手價格30元，2款可選，趣味可愛。	5.571	3.875	0.495	1.452	news
1809	美國在中日釣魚臺爭端中「選邊站」，不僅將損害中美關係大局，破壞亞太地區的和平穩定，而且使美國在亞太地區的戰略利益受損。	3.667	5.286	0.471	0.881	political
1487	昨於新加坡登場的第一屆《英雄聯盟》Garena超級聯賽最終決賽（ＧＰＬ），「臺北暗殺星」以三比一擊敗強敵「新加坡先鋒」再度摘冠，勇奪美金一萬元獎金、摺合新臺幣約三十萬元。	6.333	4.167	0.816	1.067	news
1134	臺灣電玩隊伍臺北暗殺星在世界電玩大賽中奪冠，政府不僅考慮替代役等優遇辦法，經濟部也說要協助企業取得世界市場，但立委翻出經濟部推動遊戲產業政策要點，經濟部連舉辦遊戲玩家大賽，首獎都規定不得超過10萬塊，立委批評政府心態落後，經濟部說會檢討。	3.333	4.250	0.816	1.09	news
2849	如果中國人每一年的紀念六四的活動都只是年復一年地譴責、咒罵兇手，歌頌、讚美死難者及其家屬，這樣的紀念究竟有多大的價值呢？	3.000	6.750	0.0	0.661	news
816	總體來講，對登封的印象比較差，基本上是髒亂差的典型！	2.333	6.556	0.943	1.165	hotel
671	地段好，設施全，服務一流，希望以後還能入住此酒店！	6.875	6.000	0.599	0.756	hotel
1351	九人的廂行車，被對向的酒駕車輛迎面撞上，整輛車翻落山溝，結果現在一人死亡，兩人昏迷，六人重傷，肇事駕駛也重傷昏迷中。	2.333	4.000	1.155	0.926	news
82	閨蜜總是在半夜三更給我訴苦，說她十分想念某某某，甚至想得廢寢忘食，在那個男的對他呵護備至要星星給星星要月亮給月亮的時候她三天兩頭玩失蹤，如今人家有了女朋友她就要死要活了。	3.000	5.375	0.535	1.218	book
1880	突然想到當年林義雄的二個堅持，一個是立委減半，一個是反核四立委減半這件事從現在的事後諸葛來看，是錯誤的，大錯特錯沒有任何法理根據就說減半就減半我還記得當年聖教主義雄說過立委減半至少可以讓全民少養一半垃圾可是現在情形是垃圾減半了，人民還是選出垃圾喔～不，是垃圾中的霸主我想知道後來聖教主有對此表示後悔還是承認自己錯了嗎?	2.625	6.778	0.484	0.916	political
1696	其實臺灣缺的不是民粹政治，缺的是負責任的反對政治。	4.250	5.750	0.829	1.199	political
2619	常把苦菜端上桌小滿節氣人體生理代謝旺盛，營養物質消耗會增多，應及時進補，且偏於清涼，切忌過於溫熱，損耗陰津，過於寒涼的食物也不要攝入過多。	5.167	3.625	0.373	1.996	news
913	這款是集成顯卡，我覺得夠用了，當時還在v450a－tfo和這款中猶豫不決，看到有搶購就一個衝動買下來了，現在覺得此舉很明智，呵呵。	6.000	4.714	0.0	1.278	laptop
2712	他說，剛爬上包山時感到吃力、速度較慢，與對手爬上包山的時間很接近，又說起步和落包山過程緊張，估計自己到最後1、2秒才成功落地。	5.429	5.667	0.495	1.374	news
321	建議一下目前因為你都還是吃住家中但是我覺得應該要將夫妻倆的所得提出一部份拿給家裡比較實在畢竟養一台車不是說有頭款有能力繳貸款就可以搞定的事情事後的保養費、保險費、油錢、稅金都是一筆開銷再說個難聽一點的話要是好死不死A到的話那筆開銷更會讓你頭大假使不需貸款可以直接購入的話當然我會建議你可以買假如要貸款的話買台機車給老婆比較好不會騎只好慢慢教他	5.000	4.857	0.816	0.99	car
1735	如今受訪者既不滿意施政表現，又不願罷免，說明不滿意度高應是屬於高期望以致於高失望的第一種狀況。	3.625	4.444	0.484	1.066	political
1508	玩笑歸玩笑，29歲的她對結婚確實有憧憬，「信仰也是一個令我轉變的契機吧！	6.500	5.111	0.5	1.595	news
2574	5月14日訊息，今天聯想推出了一款小新螢幕魔力擦，一噴一擦，螢幕宛若新機，而且安全殺菌，售價59元，目前已在聯想商城開售。	5.778	3.111	0.416	1.853	news
1450	世界客屬總會榮譽總會長吳伯雄也以「寧賣祖宗田，莫忘祖宗言」，強調語言傳承的重要，鼓勵大家只要有心就能學好客語。	6.000	5.429	1.054	0.728	news
165	我已經能想像到小侄女拿到書的享受樣子了，呵呵，贈人好書，手有餘香啊，我也開心呢~~	7.625	6.286	0.484	1.03	book
930	選用可靠的防毒軟體，找尋專門防病毒信件或檔整合的應用程式，強化對抗惡意應用程式和信件的能力。	5.750	4.625	0.661	1.111	laptop
2217	據索尼向美國專利商標局申請的檔案中提到，他們描述到一款有著震動反饋的VR手套，甚至會有移植到其他服飾上，像是帽子、褲、上衣等的可能，而且會有冷、暖感。	6.000	5.571	0.0	1.05	news
379	無知吧!怎麼會有人說Altis好?	3.333	6.667	0.816	0.667	car
2834	巨集達電近年在智慧手機市場競爭節節敗退，連續3年大虧5個股本，受惠去年出售Pixel團隊給Go巨集達電連3年股利掛零後，今年終於可以發股利了！	7.167	6.200	0.687	0.4	news
627	超級可怕的旅館，進門後根本不是45平方米的大房間	3.000	6.000	0.0	0.707	hotel
1602	就在釣魚臺爭端正處於僵持之際，美國派遣航母進入釣魚臺附近海域。	4.667	3.625	0.471	1.317	political
467	說真的買到最便宜的我真的會很開心，買到很貴的會嘔個老半天可能是我比較不同吧!!我買東西都希望買到便宜的，不想買貴被當盤子敲耶~回想起來，家中從以前到現在已經買入1X台車子，只要交完車付完錢後，再也不見業代蹤影..屢試不爽喔!幾乎各大汽車品牌都有過經驗，所以從此再也不相信業代口中的服務價格便宜給我，對我來說才是最好的服務~~	5.333	5.222	0.943	0.916	car
1001	遠不如以前的IBM，現在做工差，模棱角及邊緣有明顯的劃手，其次就是如細微觀察，就是兩個筆記（我買了兩個）質量有明顯區別，上次買個lenovoy430高配置，有問題，還退掉了，商品有問題，反正就是湊合吧！	4.000	5.667	0.816	0.943	laptop
1862	陳院長指出，自由經濟示範區之規劃，係秉持自由經濟的觀點，以達成「參與區域經濟整合、「提升國家競爭力」與「釋放企業活力」等三大目標。	6.375	4.167	0.484	1.572	political
778	不過貴陽整個就是一個髒亂差的典型，東東還貴得嚇死人，去貴陽的話就不要抱什麼美好的願望了！	3.143	6.500	0.639	0.5	hotel
649	住豪華標間，寬敞，重裝修較新	5.556	4.444	0.497	1.165	hotel
1414	智慧電風扇則是從同學家的XBOX360Kinect體感遊戲機獲得靈感。	5.000	3.250	0.5	0.968	news
603	總體不錯的酒店，樓宇結構有點怪。	5.111	3.875	0.737	0.599	hotel
2457	天文學家認為，藍移可能是星系團的巨大質量在奇特的軌道加速其星系高速運動，結果是隨著時間的遷移部分星系同時遠離和接近我們。	5.000	3.000	0.0	1.773	news
2506	許多人將這視為理所當然，但如果試著想像旁人難以理解我們的說話或表達方式時，這肯定令我們極度不便和沮喪。	3.778	4.300	0.416	1.735	news
102	去感受喜悅、和平和愛……雖然不是很容易，但是我發現最近困擾我的一些負面情緒正在慢慢流失。	6.500	4.625	0.707	1.409	book
1308	TPA隊長Mistake在接受轉訪時表示，「如果你有夢想，就勇敢去實現，不要後悔。	6.500	6.000	0.707	1.0	news
1146	陳揆承諾，未來會有所檢討。	5.000	4.500	1.155	0.707	news
1255	傅碧惠原本忙碌於工作及基督教會小組的服事之間，四十出頭小姑獨處的她，年輕、亮麗又有幹勁，對未來美容事業的拓展一直有個藍圖；對教會的事奉，她更是積極參與，生活節奏快且充實。	6.714	5.000	0.452	1.0	news
1399	更諷刺的是，挪威人民已經兩次公投反對加入歐盟，因此挪威總理史託騰伯格在恭賀歐盟得獎之餘，也不忘表示挪威目前仍無加盟計畫。	4.375	5.429	1.111	0.728	news
2883	但是強勢的性格，也會帶來負面影響，別人可能會認為你是一個自負或傲慢的人，而你只是習慣了做自己，不想浪費時間取悅別人罷了，哪些跡象表明你性格強勢呢？	4.375	4.857	0.484	1.355	news
1785	當時他承諾與中國達成開創性協議，結束臺灣經濟日益邊緣化。	5.556	4.500	0.956	1.225	political
1765	中共官方喉舌報「人民日報」也報導，黑格在擔任參議員時，一再反對制裁中國。	4.778	3.875	0.416	1.536	political
624	海景不錯，屬於在威海最好的吧。	6.889	6.000	0.567	1.0	hotel
2531	自此，臺灣被割讓給日本，開始了日本50年的殖民統治，臺灣人民進行了犧牲巨大的武裝抗爭，最後以失敗告終，但臺灣人民英勇對抗日本侵略的歷史應該被牢牢記住。	5.000	7.125	1.414	1.053	news
2253	這次主題中登場的共有名偵探皮卡丘、噴火龍、胖丁和魔牆人偶四位角色，重點是，他們外型與聲音都將與電影版中一致。	5.833	4.800	0.898	0.748	news
1294	Moscow5是上一季冠軍，實力雄厚，在準決賽第一局就以猛烈炮火重挫「臺北暗殺星」，但ＴＰＡ以極強的抗壓力及團隊默契，主力王榮燦表現精湛，一旦領先就極力壓制對方，逼使對方求援而露出空檔，而且懷抱「不要死，不能死」的奮戰精神，在接下來的兩局比賽中完全掌握了節奏，最後以二比一逆轉擊敗Moscow5。	6.750	5.625	0.433	0.857	news
604	攜程訂單下了，可是酒店內部協調慢，抵達後等了很久纔拿到前臺；前臺男服務員很差，陰陽怪氣的。	2.667	5.778	0.471	0.916	hotel
533	爆胎就是鬆油門鬆煞車，全心對付方向盤	4.889	5.000	0.567	0.707	car
1136	要點中寫明，鼓勵業者投入國際及動畫影片跟遊戲軟體創作的獎項，但國際級的創作，獎金卻訂出上限50萬，還有鼓勵業者自行開發具有商業價值及國際水準的數位內容產品，獎金也訂出30萬上限，連辦電玩大賽培植遊戲人才，首獎獎金也明訂不能超過10萬塊。	5.000	4.333	0.816	0.943	news
1882	況且，在對抗外侮的國家動員下，更能掩蓋國內各項既存矛盾，這無論是對正訴諸改革反腐的中國，或是扭轉日本人民對「中國即霸權」的刻板印象，都沒有幫助。	3.667	5.286	0.471	0.7	political
14	故事情節的發展，我也心中甜蜜，酸楚，失落，幸福。	5.125	4.571	0.781	1.05	book
1938	國家副主席習近平15日在北京看望了柬埔寨太后莫尼列，對柬埔寨太皇施亞努逝世表示哀悼和慰問。	3.889	3.429	0.875	0.495	political
2530	耶路撒冷希伯來大學研究人員進行的一項令人難以置信的新研究，首次發現了一種將面板細胞轉化為構成早期胚胎所有三種幹細胞型別的方法。	6.714	5.571	0.452	1.05	news
289	疼老婆是一件好事!很好....像我也是剛結婚!!雖然家裡有車子雖然上班公里數差不多要13k不過能盡量不開車還是不開車!說真的開車油錢好貴唷....除非天氣真的很糟糕才會想要開車!!兩個人的收入差不多不到六萬不過....沒認真算過不知道有沒有結餘....騎機車跟開車的開銷真的有差....多存一點真的需要的時候在買吧!!說是這樣子說!我自已也想買台車子給老婆開....	5.333	5.400	0.667	0.49	car
932	本身即代表消除了製造商或系統商對於設備的某些限制，讓用戶幾乎不受管制的安裝程式和決定使用設備方法。	5.333	3.750	0.471	1.199	laptop
2109	現階段的3D列印技術尚不足以列印肺部或者史特拉迪瓦裡琴，但是惠普本週四推出的新型3D印表機有望讓這項技術變得更加實用。	6.429	3.857	0.495	1.125	news
2382	他認為，港鐵及禮頓似乎無就問題進行技術調查，很快就基於有明顯不達標問題而拆除，無詳細分析出現裂痕的原因等。	3.750	4.500	0.433	1.118	news
