No.	Text	Valence_Mean	Arousal_Mean	Valence_SD	Arousal_SD	Category
2350	在認識到美國能入侵幾乎任何系統之後，北京計劃採用含糊的安全性的方法，執行定製作業系統讓美國難以監視中國。	4.429	5.167	0.904	1.213	news
2485	如今的一面二面三面，不但要在1小時內做完30道技術題，還會向人性的軟肋發問，你的同事很愛出風頭，又必須和他在一個專案組，該怎麼辦？	3.625	4.000	0.484	1.491	news
2178	Titan安全金鑰是由穀歌推出的一款防範網上誘騙的雙重身份驗證裝置，內建硬體晶片，其中包含由Google設計的韌體，用於驗證金鑰的完整性。	5.857	4.429	0.639	1.05	news
1723	軍人們很高興能有人保護他們的國家與經濟。	6.250	4.625	0.661	1.317	political
1518	鼓勵莘莘學子，羅許基金會針對高中（職）以上的單親、清寒家庭學生提供獎助學金，於1日在羅東博愛醫院舉辦101年度頒獎典禮，讓勤奮好學的孩子們能順利完成學業。	6.625	3.889	0.484	0.737	news
2639	據相關報告顯示，68%的家長對孩子的教育感到比較焦慮、非常焦慮，90後家長已開始為孩子教育未雨綢繆，80後二胎焦慮處於較高水準。	3.625	5.250	0.857	0.829	news
1439	男友拋下天后光環，與錦榮走遍各大夜市高調曬愛，詹惟中稱Jolin蛇年感情運將比較不穩定，反觀錦榮的愛情運相當旺，會有較多的外在誘惑。	4.714	4.800	0.452	0.98	news
387	所以，沒任何東西是完美的，勇於面對自己的缺點，不要老想操縱這些媒體，來欺騙這些消費者！	3.125	6.429	0.331	0.495	car
2125	通常大家在AppleMusic、QQ音樂、網易雲音樂聽歌時，往往會根據天氣、心情、場景、關鍵字等來選歌。	5.444	3.778	0.685	1.03	news
511	偷很多不是只有這部就開始了，但是還是很多人買，甚至更多人討論T牌的安全性不足的問題，不過買的人就是多，你放心！	4.750	5.750	1.199	0.661	car
465	今天下午去朋友車廠突然看到一台車跑來仔細一看這不是準備要國產化的CAMRY嘛!而且還是HYBIRD版趕快跑去對面拍幾張照片至於車裡面的人不知跑去哪了呵呵...看到有人說原來是舊款的CAMRY難怪覺得怪怪的無所謂囉!反正本來就沒再注意TOYOTA的車認不出來是正常的囉!所以大家就看看照片就好了	4.778	4.000	0.916	1.0	car
676	~~~~~~總之跟服務檯說什麼他們都不答應，都不能得到解決。	3.111	6.625	0.567	0.484	hotel
2958	此外，HEPA濾網可有效過濾空氣中包含病毒與細菌並捕捉小至PM0.1的懸浮微粒，過濾空氣中99.5%髒汙，提供乾淨、舒適又安心的家居環境。	6.375	3.111	0.484	1.449	news
27	而正處於那個生命階段的讀者也許會產生共鳴，發現原來他們在這個時候的想法並不是孤獨，沒有人明白的。	4.250	4.250	1.199	0.968	book
1430	甚至微軟以併購方式買下Skype，並計畫將MSN帳號與Skype合併，但是失去的舊有優勢恐怕不是當初可以預料的。	4.000	3.857	0.707	0.99	news
2560	來自新加坡的共用單車oBike，以無樁共用方式在臺北市經營，不過今年年初經營團隊就傳出倒閉的訊息，而現在臺北市大小街道都還可以看到oBike的遺棄車輛。	3.500	4.333	0.5	1.054	news
2010	還是對一種自身感覺的形容，指的是你對我有吸引力，我跟你在一起讓我感覺到喜悅、放鬆，所以我想看到你，想跟你在一起。	6.500	4.700	0.5	2.283	news
1525	另外，也不要講出做不到的處罰，與其用「你再不乖就把你丟掉」，還不如實際一點，例如直接警告他說：「你再不聽話，等一下就不能看卡通！	4.750	4.778	0.661	0.916	news
752	最主要前臺小姐服務很不好，冷冰冰的，尤其是那個臉蛋胖胖的小姐，臉上象塗過糨糊一樣，一點沒有微笑。	3.000	6.625	0.0	0.484	hotel
128	社會上處處可見“和諧”，人在“和諧”的環境中生活，哪麼每一個人不都過上了幸福的生活嗎？想自己過幸福生活的人，就去看《小知道答案》吧！	5.875	5.125	0.927	0.927	book
2444	可惜的是，胡適談佛，永遠就只能談其五分之二，他這個實用主義者，對那個不實用的五分之三，他也就不信、不修、不悟了……。	4.333	3.333	0.471	1.491	news
214	其實在網上我已經看過N遍逃愛記了，但仍忍不住買了紙書來珍藏，非常喜歡逃愛記，顧正榮非常符合我們對愛情的想像，深情，溫柔的男主是每個女生都想要的，毫不意外，我也非常喜歡顧正榮。	6.250	5.111	0.829	0.875	book
1741	不是只有你們會無視於法治民主，而是你們用壓迫別人的方式讓人就範.	2.556	5.714	0.956	1.03	political
1721	我對於能與各位一起成長感到很榮幸。	6.500	6.222	0.5	0.629	political
1332	他鼓勵學生，每個小螺絲釘都是重要角色，不要放棄自己。	6.625	4.714	0.484	0.881	news
1060	沒有得到救援，「我感到非常內疚」，也希望所有消防同仁都要感到內疚，「這種事情不容釵A發生」，一定要拿出決心與魄力，不是光消防局的事，巷弄的改善，「地方政府責無旁貸」，消防通道要維持其權威性，誰敢停車馬上拖吊。	4.000	6.444	1.054	1.066	news
1278	不久，五人結帳離去時，吳又追出，其中李姓大學生和友人說話時，吳即對李揮了一拳，造成下嘴脣撕裂傷。	2.444	6.250	1.165	1.299	news
711	酒店剛剛裝修好，有點氣味，我能忍受，同事不行。	3.556	4.222	0.685	0.786	hotel
2576	勇士在上一場以4比2勝出火箭，拓荒者則是以4比3險贏金塊，拓荒者與勇士的第1場西區決賽賽事可於15日早上8點30分在LINETODAY線上直播直接觀看。	5.500	3.900	0.5	1.578	news
1393	求求你們，向我們這些無助的家長伸出援手。	3.375	6.500	0.696	0.707	news
2387	被鴿在心理學上叫做社會排斥，還有很多學者會用socialexclusion,ostracism來交替使用。	4.889	2.700	0.314	1.735	news
2618	今年4月，入住洲際酒店集團旗下杭州洲際酒店的旅客發現，這家酒店富麗堂皇的大堂內，出現了一臺風格十分現代化的自助機器。	6.000	4.333	0.0	2.16	news
2133	數位身份証整合虛實並確實加密保護隱私，是否會有國旗引發討論，徐國勇表示目前討論中，他個人也贊成放上國旗，未來定案後會正式宣示。	5.714	3.857	0.881	1.959	news
2915	雖然絕大多數的黃疸是無害的，但少數有特殊原因、黃疸數值異常高或是持續很久，則需考量是否有特殊致病因素並考慮治療。	4.556	3.333	0.831	1.633	news
1536	有好長一段時間，她恨父親不讓她走想走的路、做想做的事。	2.625	6.000	0.484	0.926	news
2610	啄木鳥、麻雀、鴿子是陸地上相當常見的鳥類，但如果在鯊魚的肚子裡發現它們的蹤跡，你會懷疑自己是否不小心穿越了。	5.000	4.500	0.0	2.062	news
978	原裝鼠標相當好，就是小了點。	5.571	4.714	0.495	0.7	laptop
1516	校方強調，簡姓學童學期末當天，被父母親失手虐打致死，因現在是放寒假期間，同學目前都還不知情，開學後會進行班級關懷輔導，減輕班上同學對此事件所造成的心理衝擊與陰影。	3.286	5.143	0.881	0.99	news
638	一家三口入住兩天，很滿意的一家賓館。	6.778	5.143	0.629	0.833	hotel
575	地毯有點髒。	2.900	5.143	1.3	0.99	hotel
2643	今日俄羅斯5日報道，俄羅斯航空一架蘇霍伊100超級噴氣機在莫斯科謝列梅捷沃國際機場迫降時著火，機上有78名人員，包括6名機組人員和7名乘客。	3.000	5.000	0.0	0.577	news
1598	當然，政府的責任最大，務必有效思考對策：一、救火救急，息怒第一：搧風點火不是人民之福，熄火重建纔是全民所盼！	6.000	5.889	1.155	0.994	political
1743	民進黨面對中國政策應該放下仇恨，多以人權、平等的觀點來看待，讓中國沒有動武的藉口。	6.000	4.714	0.926	0.452	political
1991	「高雄發生大災害你們還在幹政治？這個板沒救了」最喜歡講這句話的是誰？不就是那些八卦板的長駐3.0綠吱嗎？這個板不就是幹政治而設立的嗎？為什麼不能幹政治？多的是在國家有重大災難時在非政治板面ex:八卦板)幹政治的綠吱自己在不能講政治的板面，批評時政批得很爽卻來大聲指責這個「因幹政治而設立的板」在國家有重大災難時不准批評政治人物否則就是沒人性我不知道這算什麼嚴以待人寬以律己的標準？	3.556	7.000	1.257	1.155	political
755	酒店的服務人員服務態度也不怎麼好，給的房卡也搞錯開不了門，還要我親自把卡送到樓上大廳去換。	2.889	5.714	0.737	0.881	hotel
371	喇叭這一代還是差勁透了。	2.778	6.143	0.416	1.125	car
11	看完這本書的時候，我內心對愛情的看法再次進行了調整，身不由己的調整。	5.125	5.125	0.599	0.781	book
514	個人認為會買toyota的客戶大都不會做買車前的安全比較，有可能是老一輩口耳相傳或厝邊朋友的意見。	4.778	3.875	0.916	0.927	car
763	服務員素質很高	6.444	4.857	0.497	0.639	hotel
2435	要求政府採取更為嚴格的審查機制、呼籲企業秉持良心與社會責任拒絕販售，同時集結消費者力量拒買、拒吃，合力防堵基改入侵我們的生活。	6.571	6.125	0.495	0.781	news
231	這本書帶給人許多思考，即使不是自己或身邊的親人正面臨死亡，依然是本值得一看的好書。	6.889	4.111	0.737	1.197	book
536	前年是我老婆嫌她手邊錢太多想換車見鬼了我窮得很她卻有錢?	2.778	7.125	0.916	0.599	car
2626	被指控外面有私生女，高雄市長韓國瑜忍無可忍，今日下午赴北檢正式提告媒體人吳子嘉，希望檢方盡速調查以還他清白。	3.429	4.667	0.728	0.943	news
2798	只是因為王家、麻衣兩方堅持不願讓出孩子，導致之前談判有如一灘死水毫無進展；不過王泉仁對於親生骨肉不聞不問，除了讓麻衣徹底心寒，也讓巨集仁王家爭孫一事再居下風。	3.444	3.375	0.497	1.317	news
153	我想在她內心的最深處，愛的那個人依然是小浪。	4.143	4.000	1.125	1.0	book
232	年邁的祖父母減輕對死亡的恐懼，但是我們可以更多的關愛他們，讓他們在世的每一天都不至於感到孤獨。	6.444	5.500	0.831	0.764	book
2601	假如各位覺得現成的LINE貼圖無法貼切滿足聊天情境，那麼隨你填貼圖有更多發揮個人創意的空間，同時購買一次就能無限次隨時修改貼圖文字，十分值得入手！	6.286	5.125	0.452	1.763	news
295	關於你的疑問，確實沒人保證開雙B就不會死，開T就穩死，但發生車禍時的存活率確實有差，單單為了出門時可能有十萬分之一發生事故，發生事故時的存活率差10%，這樣算起來只增加百萬分之一的存活率，有需要選購較安全的車款嗎?	3.875	5.375	0.599	0.992	car
571	對您此次入住的不愉快酒店深表歉意，若您對客房清理的時間有一定的要求，請撥打房間內座機上的一鍵通，前臺會通知管家部及時給您的房間進行打掃。	5.444	3.429	0.497	0.728	hotel
1695	當時「萬年國會」正當性不足，才藉由「國是會議」取得後來修憲的正當性基礎。	4.500	4.750	1.025	0.661	political
1786	「全國看起來都同意一件事：馬先生是個沒用的笨蛋。	3.875	5.429	1.053	1.178	political
531	我個人是換KYB黑筒避震器覺得比原廠還好多了而且又不會太軟覺得可以接受，但我看網友都說Toms不錯也可以給版主參考我覺得每台車子都有優缺點改善缺點即可，至於版主提到何時更換我也有想過此問題，最後我認為越早越好，不要開了四年保固後才換避震器我個人覺得失去更換意義，給您參考~~	5.250	3.000	0.433	0.707	car
2187	2011年之前的幾款Mac仍然可能容易遭受類似ZombieLoad的安全攻擊，而蘋果無法解決這個問題，因為英特爾不會發布必要的微程式碼更新。	3.889	3.333	0.737	1.826	news
2161	在日常生活中遇見一些貌似很蠢很不方便的設計，直到有一天偶然間明白設計師的用心之後，讓你豁然開朗，然後大呼過癮。	7.000	5.375	0.866	1.798	news
2247	說實話，我從事大氣科學方向的學習也有些年頭了，對於這個概念我還把握不好，別說不從事這個方向學習的成人，更不要提知識面更窄的孩子們了。	3.444	3.444	0.497	1.641	news
917	跑起來還是不錯沒有衝突。	6.125	3.857	0.331	0.99	laptop
1780	基於對科學的信仰，我決定以後在中國共產黨及人民行動黨之中擇一支持。	4.500	5.750	0.866	1.199	political
1510	如果到了那個年紀，真的想要生小孩，也確定找到一個不錯的對象，那就生啊！	5.556	4.857	0.685	0.833	news
129	這本小說是傷感的，是讓人心碎的，查理這麼一個正直，勇敢的男子漢被無情的戰爭絞殺是任何人都不能接受的，但小託卻要承受這個痛苦，他的家庭是那麼的不幸，以至於他的成長充滿陰影，但他能夠感受生活給他帶來的快樂。	3.000	6.167	1.0	1.213	book
1456	蘇震清小時候住鄉下，經常和朋友在田間抓田鼠、青蛙，難免遇到蛇，還有一次用小蝌蚪釣青蛙，結果卻釣到一條蛇。	5.111	4.778	0.567	1.133	news
1052	蔡女覺得兩人個性和背景差異頗大，上月提出分手，但曾某不願意，軟硬兼施希望女友回心轉意，卻都沒有進展。	4.100	3.667	0.943	0.943	news
1326	學校除決定將他在教室的課桌椅保留到運動會結束後，還會在運動會時將他的椅子帶到操場與同學們在一起。	5.750	4.000	1.392	0.756	news
2873	員警的白目提問，包含要受害人比較性侵與過往性經驗的感受，問受害人有沒有努力反抗，還問她是不是在下意識中，知不知道受害人要是完全沒反應，性侵很難得逞。	3.000	6.125	0.667	1.452	news
2807	節目指出，倘若鄭在其他國家或城市為官，早已被罷免撤換，只有港府及本港立法會議員選擇窩囊不出聲，不盡職按民意向鄭追究到底。	3.714	3.333	1.161	1.795	news
974	CPU顯卡也完全夠用，介面也非常齊全，總體來說很滿意！	7.143	5.000	0.35	0.816	laptop
954	顯卡是65nm的，估計是9300GS的馬甲，nVidia的老把戲，估計再這樣玩下去要NV倒閉了。	3.750	5.500	0.433	0.866	laptop
853	另外散熱也很好，沒有傳說中的那麼差，看來需要親自體驗才知道。	5.889	4.571	0.737	0.904	laptop
828	感謝您對大連銀帆賓館的良好評價！	6.667	4.143	0.471	1.125	hotel
2113	據官方統計，此次的年度盛典成績不俗，線上觀看近2000萬，全網過億曝光，微博話題映客527星光夜累計閱讀量破億，600萬份互動禮品被迅速搶空。	6.400	5.857	0.49	0.833	news
895	所有驅動都能裝齊全了，指紋識別，非要在XP下使用的朋友，可以用替代驅動.	5.222	3.857	0.416	0.833	laptop
2165	這款很有價格優勢，無磷，不含防腐劑和熒光增白劑，主要包含脂肪酸鈉、甘油和沸石粉等，適用於內衣內褲、貼身衣物等，可以瓦解血漬，建議有需求的值友別錯過。	5.625	4.500	0.696	1.803	news
1253	這句話，糾結出社會心中的哀慟。	3.333	3.571	0.471	1.178	news
990	本人兩天前4999時下的單，昨天下午最後截止日提的貨，系統還沒換，電池沒充電，不過現在又有點資金，看中一款2530p，想把昨天拿的這款出手。	5.000	3.500	0.0	1.118	laptop
1509	我在教會看到很多不離不棄的情感，心裏面也會希望有一天能夠遇到這樣的感情。	6.444	5.625	0.685	0.696	news
2372	又或想像一條人行道有些許紙屑，如果無人清理，不久後就會有更多垃圾，最終人們會視為理所當然地將垃圾順手丟棄在地上。	3.500	3.857	0.5	1.641	news
1844	對於辨別這個團體遊很大的幫助。	5.375	3.556	0.484	1.165	political
118	自信是小朋友邁開成功的第一步！	6.750	5.571	0.433	0.495	book
2670	如果你喜歡整個旅程編排妥當，井井有條，去年推出的手機GoogleTrips可以幫到你，最近Google將這服務推出網頁版，更方便使用者在電腦編排行程。	6.714	4.833	0.452	1.067	news
1358	三溫暖員工發現不對，將男友攔下，趕快跑出門口呼喊經過的員警，這時才叫了救護車，將吳姓少女送醫。	4.250	5.429	1.09	0.728	news
1619	近50名外勞與移工團體代表高喊「反工資脫鉤，要同工同酬」、「反血汗長照，要家服立法」，要求政府正視移工面臨的問題。	2.875	6.000	0.599	1.414	political
2830	其次是，仍在內地生活但噤聲，家人不提，孩子不知，表面上若無其事，實際上刻骨銘心，午夜夢迴，難以釋懷的朋友。	4.143	3.500	0.833	2.0	news
2684	從現場閉路電視片段所見，遇劫男子手持黑色手提袋行過，車內埋伏疑匪隨即落車，不久返回車上開車離去，遇劫男子的頭及手受傷，送往伊利沙伯醫院治理。	3.500	5.667	0.5	1.106	news
257	我很喜歡這套書，她也是阪田先生畢生著作的精華，值得你擁有！	6.750	5.286	0.433	1.75	book
599	兩個人住標準間，只給一張房卡，還很挑釁的看我。	3.375	5.375	0.484	1.111	hotel
2150	高雄有一家牛肉麵老闆王士春，16歲喪母，就算事業版圖拓展到香港、中國，卻沒有機會對自己的媽媽表達孝心，於是在母親節這天，決定用一碗燉到軟嫩的牛肉麵聊表心意。	6.444	4.667	0.956	1.826	news
398	油耗比安全配備還要更吸引人更重要?	4.222	5.444	1.03	1.641	car
1647	於是勞保、健保的財政漏洞持續擴大，形成惡性循環。	3.333	5.286	0.471	0.881	political
471	你會很開心嗎?	5.250	5.750	1.199	0.968	car
1970	但部分國營事業在?額虧損下，每年仍可領三、四個月的獎金，引發社會高度質疑。	3.333	5.250	0.816	0.661	political
1858	但這隻針對今年的績效獎金，至於明年的情況要再看。	5.000	3.125	0.667	1.166	political
1795	甘地願意為了抗爭入監服刑這才叫公民不服從，你們哪一個甘願服刑?	4.000	6.375	0.866	0.484	political
1959	同意戶要求上樓求見郝龍斌，在市長室所在的11樓電梯出口被警方阻擋，雙方發生輕微推擠，都更處人員表示，希望同意戶先進入會議室等待副處長簡裕榮，不過遭到同意戶拒絕。	4.000	4.000	0.816	1.673	political
1946	他逝世前患有癌症、糖尿病及高血壓等疾病，在北京休養並接受治療。	3.667	4.571	1.247	0.495	political
20	呵呵，現在買了很多花草茶，還有茯苓粉，打算再做種子眼霜。	5.250	2.833	0.433	0.687	book
1205	許多粉絲在看完臺韓冠軍爭奪戰的網路直播後，意猶未盡，爭相在臉書上發表感言，甚至有粉絲提議，乾脆設個「英雄聯盟紀念日」。	5.429	5.000	0.495	0.816	news
2167	近幾周以來，美國和中國關係的緊張以及學術交流審查的加劇，增加了耶魯大學和全美大學眾多國際學生和學者的不安。	3.000	4.222	0.0	0.786	news
887	友達LED屏，獨顯，滿意，到手是完美屏，不錯	6.778	5.000	0.786	1.563	laptop
1426	叱吒科技界的微軟，其Windows作業系統、Office文書處理軟體、InternetExplorer網際網路瀏覽器、MSN通訊軟體等，自1985年起後的數10年，大家都對微軟及其產品相當熟悉，甚至是每天都要使用這些產品。	5.556	3.143	0.685	1.355	news
2314	民主派會議召集人毛孟靜批評，律政司司長鄭若驊以及保安局局長李家超，在立法會保安事務委員會的特別會議上，回應提問時言不由衷和迴避問題。	3.857	3.556	0.35	1.707	news
573	房間偏小，軟件應該能達到三星級的水準，硬體稍差。	3.778	3.286	0.629	0.7	hotel
1924	美國於10月底遭珊迪（Sandy）颶風侵襲，重創紐澤西州、紐約州及紐約市等地，造成重大傷亡，財物損失總額超過500億美元（約新臺幣1兆4427億元）。	4.000	3.000	0.816	1.225	political
34	這是我多年看書的體會。	5.667	4.000	0.816	1.069	book
2551	外傳美其名是補完正傳中空白的歷史，難聽點說就是憑空捏造故事，只要不影響本傳的劇情，作者喜歡怎樣寫也可以。	3.857	3.857	0.639	1.959	news
1238	遊戲基地總經理江文忠：「像電玩打怪，就會經驗值就有錢，可以立即得到一些成就，那在工作上如果有機會變成這個樣子，在工作上有機會，做每件事情都有評核的標準，他就會知道怎麼去努力得到他的獎賞。	5.714	5.000	0.452	1.118	news
2664	在努力工作多年以後，退休者理應有享受悠閒生活、社會保障的資格，和年長者優待福利等，然而這些特權根本彌補不了年長者大幅降低的社會地位。	3.429	4.875	0.495	1.166	news
2515	禮堂內擠滿了康仔工運上的朋友、共事多年多年的戰友、協助過的工友.......禮堂內臨時加了很多椅子，但都不敷應用。	5.429	4.143	0.495	0.99	news
2378	新竹湖口一名甲保廠履車廠服役的徐姓男子，為了想要休假偷懶，竟然向連上長官稱說，自己的爺爺、奶奶和外婆相繼過世，企圖騙取每次8天、共24天的喪假。	3.000	5.250	0.667	0.968	news
359	隨你高興	3.222	5.500	0.916	1.581	car
282	如果是第一次養育寶寶，會有意想不到的收穫，重要的是教會你注重寶寶的個性，保護寶寶的個性，如何避開護理的誤區，如何第一時候掌握病情，如何第一時間解決問題，如何預見和防護寶寶的安全。	6.000	4.444	0.775	1.165	book
2336	iFixit猜測底下的微關開可能也有被改動到，採用新的合金或熱處理方式來延長壽命並減少誤按，但對此並沒有太明確的證據。	5.000	2.714	0.0	1.03	news
377	不知道就別在這唬爛了~這跟那些說網路慢然後說甚麼美國速度慢歐洲速度慢澳洲速度慢...沒根據就說，結果被住在國外的說你真的出過國嗎?	3.375	6.444	0.484	1.066	car
2905	在全國識字率只有40%、嚴格控管市面流通書籍的阿富汗，印刷產業並不如一般人想像得艱困，反而正在急速成長。	6.000	4.333	0.577	1.795	news
1405	馬克與艾迪住在一起、一起做鞋匠，但當兩人因遺傳性青光眼導致逐漸失明，便決定尋求安樂死。	3.625	5.250	0.992	1.479	news
2487	苦主網友進一步說明，自己雖有認出該藝人身分，但一來領0元包裹本來就必須連萬能的超商店員都沒辦法忍受這等奧客行為了！	3.286	6.250	0.452	1.199	news
622	到了酒店，問司機接機費多少錢時，竟然告訴我是免費的！	7.000	5.750	0.0	0.968	hotel
765	這次正好趕上國際柔道比賽的代表團入住，酒店對普通住客的服務有所下降。	3.750	4.714	0.433	0.452	hotel
89	當在使用對身體有幫助的物品時，請相信它，感受他，感激它，身體會吸收的更好。	6.500	4.143	0.5	1.125	book
262	收到書的那天，正好是和兒子一起去郵局去的，一到家，他就迫不急待的打開書，一口氣全部看完，特別是對書中動物、人物的神態表情，一遍一遍地翻過來對比，突然，他在房間裏大聲喊到：媽媽，這是我六一兒童節收到的最好的禮物！	7.000	6.714	1.0	0.452	book
2532	在面臨涉及領土爭議的國際衝突時，人們難免尋求歷史、史觀或宗教觀，作為各自論點的依據，因為它們往往提供有關正義、權利的準則。	5.000	2.143	0.0	0.99	news
1929	外交部說，捐款正由駐美代表處及駐紐約辦事處與美方有關單位研商，擇適當時機透過公開儀式捐贈。	5.444	4.000	0.956	1.118	political
1727	胡錦濤這次「裸退」，也創造中共史上同時卸下總書記及軍委主席先例，此舉將有利中共高層制度輪替。	6.000	5.625	1.0	1.111	political
1927	政府秉持人飢己飢、人溺己溺精神，並感念美國政府在臺灣遭受莫拉克風災侵襲時積極協助救災，捐贈130萬美元（約新臺幣3750萬元）救濟賑災。	6.667	5.143	0.816	0.639	political
178	二○○九年中國擔任法蘭克福書展主題國時，他雖受邀卻被當局禁止出境。	3.333	4.571	0.943	0.904	book
1827	想吹冷氣要電費，卻無法忍受核電的危險.	2.875	5.857	0.599	0.99	political
2770	天貓精選6月1日0點開始前2小時報價138元包郵，此款升級版19件套，細緻入微小確幸，從容待產、孕育、坐月子，做幸福媽媽。	6.857	4.714	0.35	1.666	news
2913	Google今天在美國東部發生伺服器壅塞情形，對Snapchat和YouTube使用者造成問題，網友紛紛上社群媒體抱怨這些熱門應用程式無法使用。	3.667	4.750	0.471	1.392	news
1366	王寶蒞說，不能以陳昱安砍殺父親幾刀而認定其犯罪層次，1名小孩如此傷害父親，「背後難道無更深層的原因？」，且針對刑法第57條科刑時須審酌的各項情狀，也還需盤點式調查。	3.667	5.500	1.155	1.225	news
1346	還有包子被埋在沙灘中的畫面，網友ShellyHsiao說，天啊海灘的好像什麼折磨酷刑影片...。	3.444	5.500	1.165	1.225	news
2631	英國脫歐限期推至10月31日，但文翠珊的脫歐方案，三次被國會否決，文翠珊認為，地方選舉結果為目前僵局給予新的迫切性。	4.500	4.667	0.5	1.106	news
