No.	Text	Valence_Mean	Arousal_Mean	Valence_SD	Arousal_SD	Category
2335	但具體到連鎖百強的細分業態中，還是難以突破區域龍頭髮展不均、大型超市增長趨弱、百貨超市業績平平的困局。	4.333	3.286	0.471	1.906	news
704	房間裝修時尚、溫馨，用品乾淨舒適，而且有鮮花和水果贈送，有家的感覺，服務熱情周到。	7.571	4.857	0.495	1.457	hotel
1498	NJ將順利擊敗TPA，沒想到TPA硬是闖過這關，殺入4強賽。	6.222	5.250	1.133	1.92	news
1841	另外，中油、臺電去年度大幅虧損，績效獎金仍在經濟部審查中，繼中油以「借支」方式領走三個月獎金後，昨天臺電借支四十天獎金，臺糖借支一個月到一個半月也曝光，經濟部長施顏祥昨天表示，國營事業的績效獎金還沒有覈定，油電事業借支獎金的作法，應該要檢討。	3.889	5.571	0.875	0.728	political
101	平凡的記錄不平凡的費德勒，有過輝煌，有過失落，有歡笑有淚水，相信他的路途依然精彩，勝也精彩，敗也精彩，他的完美在於追求完美......過去喜歡，現在喜歡，將來也一直喜歡，這麼一個人，創造完美，贏了多少，輸了多少，付出多少，收穫多少，ROGER將繼續完整他的人生，讓他更加美麗，我們將依舊支持，默默注視，看他怎樣打出完美比賽，畫出完美人生。	6.444	4.714	0.685	0.881	book
343	之所以有疑慮是因為這些保養的人都是熟面孔了，不過今年這些老師不見好多，沒想到之前私底下爾有聽到抱怨原來是真的還走這麼多人，所以我才有疑慮。	4.000	4.778	0.0	1.03	car
1261	有些飼主會放任自家寶貝亂跑，甚至讓狗跳上桌，這不僅影響到他人，也會讓店家對寵物關上大門，害乖寶寶再也去不了。	3.125	6.000	1.166	0.5	news
852	led冷光屏感覺更舒服，顯卡很好，加2G內存以後，最高質量情況下實況2009完美運行，流暢無比。	7.250	5.833	0.661	0.898	laptop
44	愛情中的把持與堅韌，真的太讓人感動。	6.375	5.333	0.484	0.745	book
386	其實，大蟒也並非這麼完美，還是有很多缺點的！	4.333	4.375	0.667	0.992	car
1658	可見人民的憤怒已經到達臨界點，一觸即發，若沒有適當發抒管道，恐造成社會集體動盪不安。	2.667	6.625	0.471	0.696	political
1026	電玩「英雄聯盟」第二季世界大賽冠軍戰，由6位臺灣選手MiSTakE、Bebe、NexAbc、Colalin、Lilballz、Stanley與1位香港選手Toyz組成的「臺北暗殺星」（TaipeiAssassins，TPA），以3比1擊敗南韓隊伍（AzubuFrost，AZF），抱走百萬美元獎金（約新臺幣3000萬元）	6.500	6.429	0.707	0.495	news
2781	有新人換上在配偶欄列出另一半名字的新身分證之後，喜極而泣，亦有同性伴侶希望，社會紛爭可以告一段落，各方能夠和解。	6.556	5.333	0.497	1.054	news
2392	值友4148553512山東羊角蜜甜瓜，清甜爽口~京東中國特產·平遙扶貧館售價52.8元，可領取13元優惠券，下單實付39.8元包郵，摺合7.96元/斤。	5.625	3.500	0.696	1.871	news
2182	在叫車服務公司Uber即將上市之際，一家計程車工會上週五表示，Uber在紐約的司機下週將舉行罷工，抗議他們認為不公平的就業條件。	4.143	5.571	0.833	1.294	news
1643	馬英九表示，把酒測標準提高，要更嚴，讓大家知道開車上路就是很危險的事，所以絕對不能喝酒，「你一喝酒就有可能被移送，至少有將近廿四小時你會失去自由」。	5.286	4.714	0.7	1.03	political
1140	以外型來說，要對抗南韓團體應該不難，但是舞蹈和唱功有待加強。	5.000	4.667	0.667	0.471	news
1983	只要沒看到支持FACE先推動配套，都是偽FACE狗良養團體。	3.000	6.500	0.707	0.764	political
2388	梅小芳順滑面料，簡約舒爽~天貓商城報價178元，使用40元優惠券後實付138元，近期好價，感興趣的值友不要錯過哦。	5.857	3.571	0.833	1.498	news
1367	前天下午，高雄市鹽埕區新樂街上發生疑似男女感情糾葛的情殺案，被害的陳女在上班打工的「麻糬店」外，被疑似彭姓前男友砍殺成重傷，經送醫急救開刀後，仍有四十八小時的危險期待觀察。	3.250	4.750	0.661	0.968	news
626	酒店外表及大堂看上去挺好的，本來對它也挺有信心的，而且就在市中心，出行挺方便的，可是從進電梯開始就比較惡夢了，那電梯一點都不像是酒店的電梯，而且從電梯到房間都是一股濃濃的很難聞的味道，很噁心，我訂的是標間，設施陳舊又簡陋，實在不敢恭維，還說是三星，我覺得它只比招待所好一點點而且，248的收費簡直是太過分了	3.000	6.333	0.0	0.745	hotel
1298	陳匯中對後天的冠軍賽很有信心，希望抱回冠軍獎盃。	6.444	5.571	0.685	0.728	news
1295	臺北暗殺星隊長MiSTakE（陳匯中）表示：「兩個月前，我們還沒沒無聞，沒有想過能夠站在這裏與世界頂尖隊伍對戰，但是這兩個月來我們非常努力，也做了許多犧牲，努力與犧牲卻給我們帶來了更多。	6.556	5.750	0.497	0.968	news
1391	我能理解，我是一個無能的家長。	2.625	5.000	0.484	1.414	news
2889	波洛西表示，一名男子孤身在街上阻攔一列坦克的圖片，獲得全世界所敬仰，但中國大多數年輕人卻不知道，她對此感到很傷心。	3.375	5.000	0.484	2.145	news
962	第一次在京東買筆記本，有點擔心，不過看來是多慮了，完美屏全新機	6.667	5.250	0.667	1.09	laptop
322	不只RAV4吧，我朋友的2007買的ALTIS新車3個月不到)味道就很明顯了，因為我親身體驗過，我覺得ALTIS狀況比我自己使用的RAV4還嚴重，我的RAV4半年了，至少目前還沒有味道。	4.222	5.000	1.133	0.816	car
1245	使用武力、威脅或強迫，在鄰國或更廣泛的國際社會上都不會贏得好的聲譽。	4.000	4.625	1.118	1.218	news
155	我想如果再來一次。	5.000	5.143	0.0	0.99	book
720	我住的是2樓，窗戶不能上鎖，不夠安全.	3.625	5.429	0.484	0.728	hotel
2228	即使起步遇上挫折，但毫無疑問地智慧手機的下一個浪潮是可摺疊螢幕手機，這也確定會獲得了新世代AndroidQ在系統端的支援。	5.667	4.778	0.667	2.043	news
2886	該證型的患者常有五心煩熱、頭暈、耳鳴、失眠多夢、腰膝痠軟等症狀，或伴有口乾舌燥、舌紅少苔等問題，此證在臨床也最為多見。	4.167	2.167	0.687	0.898	news
2658	微軟安全響應中心的事件響應主管SimonPope呼籲，他們確信會有利用該漏洞的攻擊事件發生，呼籲IT管理員立即採修復行動。	4.000	4.250	0.0	1.92	news
2593	有報導說總統和賴清德民調拉近到3%，總統說是因為內閣改組後，處理問題的速度很明快，至於要不要用手機民調，她會尊重黨內機制。	5.000	3.000	0.0	1.414	news
1241	沒想到弄巧成拙，卻愈銬愈緊，只好與一起共同喝酒的朋友上派出所求助，最後在警消大費周章的動員，手銬總算順利解開，解除男子的心頭大患。	5.000	5.333	1.673	0.816	news
1782	生活不見改善，薪資停滯、房價高漲、出口衰退，馬的民調支援度創歷史新低、僅剩十三趴，使得全國似都同意︰馬先生是個沒用的笨蛋（Mr.Maisanineffectualbumbler）。	2.875	6.000	0.599	0.756	political
1158	2012年夢幻十隊，讓電玩迷讚不絕口。	6.444	5.667	0.956	1.247	news
901	聲音不錯，儘管有點小，但是不象其他人說的那麼差，總體來說不錯.	6.111	4.200	0.567	0.748	laptop
1773	第二件惡毒的事情選贏李應元其實大家都知道李應元是當砲灰但是馬英九87萬票大贏李應元48萬多票一點面子都不給太惡毒了.	3.111	6.429	0.567	1.178	political
405	更別說出差了，一天300公里也不以為奇，相對的，引擎保持在工作溫度區間，油耗自然就會好一些。	5.875	4.800	0.927	0.748	car
1467	驚悉真相後，在殯儀館守靈的林嫌之母數度崩潰，林嫌之弟震驚，愣了半晌，後來才說哥哥最近才搬回家，個性沉默孤僻，很少和家人互動，做事衝動。	3.125	4.857	0.599	1.641	news
2186	2018年8月31日，劉強東因疑似性侵在明尼蘇達大學卡爾森商學院被逮捕，警局報告顯示，嫌疑人涉嫌罪行等級為重罪，涉嫌罪行為強姦既遂。	2.375	6.000	1.218	0.816	news
2760	扁桃腺結石出產於人類的口腔裡，吐出捏碎一聞，卻是惡臭無比，患者常自覺喉嚨卡卡、有異物感，或是明明有刷牙，依然口臭惹人厭。	3.889	4.000	0.737	1.886	news
1805	評論強調，中國維護領土主權的堅定意志和決心不可動搖，在事關國家核心利益的重大問題上，中國政府和人民絕不會退讓半步。	5.750	6.556	0.829	0.497	political
450	色溫：鎢絲燈泡最燙也最耗電....LED比較省電..色澤：黃色較清晰雨天或濃霧)、白色較透亮適合黑暗)、藍色或紫色就是氣氛和炫了..紅色是警示作用..黃色是注意號誌用..所以要清晰又要透亮就是黃金光+超白光吧...但是若是用HID就得小心對焦問題...燈不是爆亮爆閃自己爽就好..避免刺瞎對向車子..造成不必要車禍.	5.000	5.625	0.535	1.218	car
2341	這款卡套採用環保PP+高透PC材質，高透耐磨，不易折斷，耐用性比較強，58*105mm尺寸，厚度5mm，適配一般證件卡。	6.000	2.571	0.756	1.678	news
867	配置算高端了同時運行flash和photoshop和word沒有感到運行緩慢。	6.100	3.857	0.831	1.125	laptop
2386	但即使和我類似的，許多無辜的生命，經過了異性戀沒有的困頓，當下我沒有選擇一股腦地倒給母親，或許和當時，急於累積連署書數量的許多人不一樣。	4.125	4.625	0.781	1.798	news
2058	作為騰訊最重要的增值服務之一，QQ會員誕生已經18年，從VIP到SVIP，從耀眼紅到尊貴黃，都讓眾多小夥伴自願掏荷包，為騰訊帝國添磚加瓦。	5.667	3.667	0.816	1.886	news
2711	十多年前，要從英冠升上英超，成功方程式大抵只有一個—體力化、衝撞、勇猛、有死球殺著，再加一至兩個頭槌王。	5.600	5.143	0.49	1.457	news
2391	天貓淘氣島旗艦店現有兒童棉綢睡衣套裝，原價22.8元，使用5元優惠券後，17.8元到手，近期好價，涼爽舒適，輕薄柔軟，親膚透氣，不掉色不起球，外穿防蚊。	5.500	3.200	0.5	2.135	news
1932	她說，臺灣的慷慨援助提醒大家，世界是大家庭，彼此應互相幫助、雪中送炭；美國感謝臺灣及各國朋友，在這段艱難時期伸出援手。	6.667	5.875	0.471	0.331	political
1064	立榮航空總經理陳憲弘表示:「立榮航空能五度獲獎，要特別感謝蘇前董事長宏義及全體同仁多年來的努力，更要感謝長榮航空導入國際級的管理體制及優質服務，大幅提升了立榮航空服務品質。	7.000	6.250	1.247	1.299	news
657	補充點評2007年10月14日：五層是夜總會，騷擾電話就沒停過	3.556	5.125	0.497	1.053	hotel
831	希望打掃衛生的時候更仔細完美一些。	4.222	5.000	0.629	1.069	hotel
2469	但是許多DIY愛好者卻對遊戲本嗤之以鼻，認為它對比DIY主機價效比低下，傻大笨粗移動性也不見得比桌上型電腦好到哪裡去。	3.625	4.000	0.484	0.756	news
323	不過SUVLIFERAV4討論區不少車主也有反映這問題，我想應該是TOYATA通病不過也有開1-2年也沒有味道的，我想用車習慣、環境也有差吧。	4.500	3.500	0.5	1.118	car
16	當自己對幸福迷茫的時候，就會想到，不要將自己手中的幸福隨便就放掉，那樣，當自己發現那是你的最愛時，已經找不回來了。	5.111	3.667	0.875	0.745	book
2503	工聯會立法會議員麥美娟在會上指出，葵青區議會早前質疑瑪嘉烈醫院重建後，連同地牢只增加6層，認為不足夠。	4.000	3.000	0.0	1.333	news
1591	未來若經濟復甦，朝野每年協商總預算時，還是可進行調整，屆時績效獎金說不定可以恢復到二.六個月，甚至更多。	5.889	5.000	0.737	0.632	political
1210	不過，日本情人節巧克力就是女送男的觀念，似乎已經落伍。	4.333	4.857	0.816	0.639	news
2520	實際上如果你能夠好好傾聽，孩子們微弱或者強烈的心聲和懇求裡，包含了許多意思，他們想說的有很多，只是，你聽不懂。	3.750	4.300	0.661	1.616	news
2724	戒邪淫網-戒邪淫論壇-戒色戒淫戒邪淫年輕時放縱任性，現在飽受不孕苦果，婦科病纏身我在20幾歲以前,按照世法還算個循規蹈矩、純潔的女孩，沒有什麼大過失。	4.286	3.000	0.452	0.816	news
2270	過去，出於對大局和行業發展的考慮，儘管聯想承受了遠超想像的巨大名譽和經濟損失，但我們始終不願意過多地談及細節。	3.875	4.625	0.599	0.992	news
2636	EllaKissi-Debrah在患有嚴重哮喘三年後於2013年去世，她的死因被判斷是嚴重哮喘發作導致的呼吸衰竭。	3.125	3.333	0.599	1.054	news
661	入住登記的時候就一臉很不爽的樣子，隨時要跟我們吵架，句句都是在抱怨和指責，白眼一個接一個。	2.222	6.500	1.03	1.803	hotel
740	推薦給節約消費的自助遊朋友~比較划算，附近特色小吃很多~	6.500	5.429	0.5	0.728	hotel
774	單就缺點羅列如下，望改進:房內夜間有異響.	3.333	4.750	0.816	1.199	hotel
1662	陳根德則建議，特赦可以朝向「有條件的政黨協商」，由民進黨提出特赦，用政黨協商方式處理，不僅可以化解社會對立的仇視，也可以讓全民一起拚經濟，陳沖迴應，「是可以讓對立的氣氛和緩」。	5.375	4.000	0.484	1.0	political
2287	曲周縣北部有個張莊，全村3400畝地，只有1780畝勉強能種植農作物，1943年發大水，村裡460多口人餓死了一多半。	2.625	5.143	0.484	1.457	news
1899	不過，賤民解放區有幾篇關於反經濟全球化論述，我認為不管是正反雙方都應該仔細思考的。	4.778	3.900	0.629	0.831	political
804	總提感覺還是相當不錯的，去揚州的朋友建議你們去住一下~哈哈	7.000	5.429	0.0	0.728	hotel
2179	在本月補丁星期二活動日中，微軟面向所有Windows10系統釋出了累積更新，但是使用者的升級之路並不順暢。	3.667	3.750	0.471	0.829	news
2255	所以各種出清建議、出清政策、出清要求的檔案隨之而來，我最早見到的一份是2018年8月28日下發的某車型追加銷售獎勵公告。	5.000	4.667	0.577	0.943	news
2867	馬幫以集物質主義、極權主義、民粹主義之大成的馬學，對官員們進行持之以恆的洗腦，摧殘了它們的善根和四端，然後把它們投放到充滿巨大利益而缺乏有效制約的官場上去。	3.000	5.800	0.0	0.98	news
2422	一名44歲女子昨日在家中進食野生菇類後，出現腹痛、噁心、嘔吐和腹瀉，同日到那打素醫院求醫，並入院治療，目前情況穩定。	3.875	4.750	0.927	0.968	news
291	或許今天當事者並不是你我，我們無法體會樓主當時在高速公路上的心情。	4.750	5.286	0.433	0.7	car
1815	所以支持廢死的人想法反而更堅定.	5.222	6.286	0.416	0.7	political
2118	商務部發言人稱，當前，世界經濟發展不確定、不穩定因素增多，單邊主義、貿易保護主義抬頭，多邊貿易體制面臨嚴峻挑戰，正常的國際經貿活動受到負面幹擾。	3.429	5.167	0.495	0.373	news
2753	首局火腿靠保送和安打攻佔滿壘，接著中田翔打成三壘方向滾地球造成雙殺，不過帶有1分打點，下一棒王柏融在首打席選到四壞球保送，下一棒渡?諒飛球被接殺，結束此局。	4.714	5.286	0.452	1.385	news
1577	另外，從美國駐利比亞使館遇襲案的調查結果看來，開打在北非國家的分支與其他武裝組織呈現出來的是另一個新面貌的恐怖主義，不見得受到巴基斯坦的開打組織高層控制，但卻極端反美。	4.625	5.750	0.696	0.829	political
1177	如果政府有意發展電競產業，網友「BigOld」希望「無感官員不要外行充內行，又只把經費消耗掉，得到自己利益，又沒做出績效成果。	3.444	4.429	0.831	1.4	news
2800	一路走來經歷不少跌跌撞撞，總是倔強的她吃了不少苦頭，談過幾段失敗的感情也曾與親近的家人激烈爭吵，走到今日，終於淬煉出能笑看世事，又不失風骨的大S，徐熙媛。	7.000	4.400	0.756	1.497	news
554	預定的是商務標間，由於客滿，酒店給我們免費升到了高級商務標間。	7.000	5.429	0.0	0.728	hotel
271	現在也覺得收穫挺大。	6.667	4.857	0.471	0.99	book
437	你們可是成了潛在的傷人/殺人犯。	2.444	5.857	1.066	1.125	car
2082	早在2017年1月，美國聯邦貿易委員會就指控高通通過一些不公平的競爭行為來維繫其在全球智慧手機晶片市場的主導地位。	3.500	5.143	0.5	0.99	news
1559	西拉伊特認定，安迪（AndiAzhar）所言反映印尼廣泛存在的一種觀點，即性暴力是正常現象。	3.667	4.571	0.816	0.495	news
1383	正義妹表示，當時聽到樓梯間有人呼救，衝出查看，赫見婦人與持刀歹徒僵持，當下只想要救人。	5.111	4.600	1.449	0.49	news
2316	有研究顯示，吃比較多飽和脂肪食物會影響記憶力，例如肥肉、皮層、雞油、豬油，還有全脂奶品，以及部分植物油，例如椰子油和棕櫚油。	4.375	2.889	0.484	1.728	news
699	客人來過都表示氣味難聞，很尷尬。	3.000	5.000	0.0	0.756	hotel
989	端莊耐看，不會過時，配置足夠，物超所值。	6.875	5.222	0.599	0.916	laptop
743	酒店裏的服務態度超差，餐廳裏的服務員的素質就更差，當時我一個人去吃飯，看見菜單上寫的酸菜魚是8塊，當時還告訴了服務員我就一個人，心想一個人正好，又點了其他的菜，誰知道付錢的時候告訴我酸菜魚是35元的，錢倒是其次的，明知道我一個人，還一個勁鼓吹他們燒的多好吃，鬱悶！	2.333	6.714	0.667	1.03	hotel
1244	與會的解放軍退役少將潘振強隨即怒斥，穀內「粗暴、狂妄、顛倒黑白、混淆是非」。	3.375	6.571	0.857	1.178	news
1409	在金牌獎作品中，大會另選出十五項特別獎，臺灣獲得五項，包括最佳發明獎、最佳青年發明獎、最佳人氣獎、最佳能源發明獎及最佳新技術獎。	6.222	4.750	0.916	1.479	news
2651	過去幾周，多位GooglePixel3a智慧機使用者爆料其遭遇了軟體方面的問題，甚至會隨機發生手機熄火的故障。	3.444	5.000	0.685	1.563	news
244	六歲時，唐優優開始口吃，這令他自卑又孤單。	3.000	5.857	0.0	1.245	book
570	感謝您選擇入住西湖四季酒店。	6.375	4.250	0.696	0.829	hotel
200	看到有人評論這本書恐怖，覺得言重了，其實這只是訓練人正面思維的一種方法，有人評論在公司受到不公正對待也能不抱怨？試想，如果你的思維夠積極，對人對正的想法都足夠正面，你的思想就會對別人產生一定的影響，任何人都需要別人用正確的態度對待自已，包括你的上司，老闆，他們也是人。	4.778	4.714	0.786	1.161	book
2495	被檢察官起訴，違反兒少性剝削防制條例的吳姓男子，不只喊冤還說，把寄養的孩子都當成自己的，不想傷害孩子。	3.750	5.143	0.968	0.639	news
54	該小說的確沒有藝術可言，對於追求精緻閱讀的人，看網絡版足夠了。	4.778	4.000	0.629	0.816	book
1874	臺灣吸引的外資只勝過非洲安哥拉，連臺灣選出的總統都只想當中國人，國本日漸動搖；過去投票給馬的人應該面壁思過、道歉，民進黨也要深切檢討，爭取更多人的認同。	3.125	6.000	0.331	0.707	political
1534	當老師是一個工作穩定的鐵飯碗，縱使她大學聯考的分數能輕易上臺大外文係，自己對社會、心理等科系也比較有興趣，仍敵不過父母的期盼而填選師大，走上教書的路。	4.556	5.286	1.257	1.385	news
2923	中國家用電器協會副理事長徐東生表示，目前市場正處於低潮期，整體行業都在承受消費需求銳減的陣痛，企業也在積極尋找新的需求點。	4.286	3.714	0.7	1.278	news
2499	據韓國SBS、ChannelA等媒體報導，勝利在本月14日的拘捕令審查中首次承認了買春嫌疑，但對貪汙等其他嫌疑仍然堅持否認。	3.500	4.000	0.5	1.0	news
2250	研究人員發現，將監禁期間無能力犯罪的情況考慮在內，曾入獄服刑的人在被判決後5年內再次被逮捕/定罪的概率有輕微的下降。	6.000	4.857	0.0	0.833	news
623	他們有免費機場接送服務，第一次聽說這種服務，不錯，好像打車要40多塊呀注意到酒店設有機場售票處，3分鐘搞定機票，方便！	6.625	6.125	0.696	0.781	hotel
1018	幫朋友買的，她猶豫了七八天，終於在18日下定決心，3299，用了張2000-100的券	5.500	4.714	0.5	1.161	laptop
803	吃得我們撐死~哈哈地理位置也比較好，就在繁華的文昌路上	5.556	6.000	1.066	0.816	hotel
1625	人卻缺乏勞動保障，政院擬定的《長照服務法》並未納入外勞，讓臺灣的長期照護系統依然建立在外勞的血汗勞動上；此外，外籍看護工幾乎沒有休假，亟需喘息服務，但《家事服務法》草案卻被政院冷凍近10年，呼籲政府應該解決問題。	4.000	4.333	1.247	1.247	political
1	愛情，如此完美卻又失落，皖雅的結局，苦澀卻又實際地描繪了宮廷女子悲婉的一生。	3.750	3.000	0.829	1.0	book
934	網路，這些網路點可能是惡意連結，攔截用戶設備和合法伺服器兼的訊息傳遞。	4.222	4.286	0.786	1.485	laptop
987	電腦工程師很專業和有效率，及時幫我排除了一些難題。	6.889	5.250	0.567	1.09	laptop
1218	「有冤報冤，有仇報仇，誰殺你們就找誰報仇！	2.375	7.667	1.111	0.943	news
2659	美國政府官方披露關於UFO的資訊一直很少，從而導致各種陰謀論滋生且經常被指責掩蓋事實，美國空軍基地第五十一區事件更是令民眾對UFO充滿好奇。	5.000	4.625	0.667	1.728	news
2674	彰銀經營權官司，臺新指財政部違約，導致臺新喪失彰銀經營權，高院判決臺新為彰銀最大股東時，財政部應支援臺新指派過半董事。	4.333	5.000	0.471	1.195	news
823	謝謝您長期以來對我酒店的關心和支持，我酒店即將申報四星級酒店，我們在硬體的改造的同時，軟件服務上也加強和提升，爭取讓每一位賓客都滿意。	6.714	4.286	0.452	0.881	hotel
2428	Zotac將於近日開展的Computex，正式推出GAMINGGeForceGTX1650窄版顯示卡，造福機殼空間受限的玩家。	6.500	4.500	0.5	1.732	news
2500	這家科技巨頭與紐約大學和加利福尼亞大學聖地亞哥分校的研究人員合作，進行了為期一年的關於防止賬戶劫持的基本安全措施有效性的研究。	6.333	3.167	0.471	1.951	news
157	最早接觸寂地畫是在《新蕾》上，後來滿心歡喜的買了她的第一本畫集《我的路1》很喜歡那種溫暖的畫風，也很喜歡配畫的文字，很細膩，有哲理，讓人感覺溫馨。	7.000	5.250	0.0	0.968	book
1777	除了我族以外，其他人的自由都要經過我的審查才行幹他媽的死學匪走出立院一定會死得很難看阿	2.444	6.857	0.831	0.35	political
1601	要求政府把事情做對（Justdoitright），不算過分，應該也沒有那麼難！	4.625	6.100	0.484	0.943	political
748	房間比較老舊，電梯果然如網友評價非常慢，所謂2003新裝修實際只是大掃除一下。	3.143	4.556	0.35	1.066	hotel
87	我一直相信，關於生存技能的書籍每一個人都應該看一看。	5.778	4.000	0.786	0.926	book
1343	死者朋友：「男生一直不讓女生走，就是以暴力威脅跟騷擾對方家人，她女子)有叫我幫她，如果有怎樣趕快去救她，所以我就有先報警。	3.000	5.625	0.5	1.317	news
2925	之後兩組人都將手放入攝氏5度的凍水1分鐘，再填寫問卷匯報痛覺感受，發現獲贈假止痛膏的一組，疼痛感比較低，顯示只是擁有止痛膏，已可以產生心理作用。	5.000	3.300	0.816	1.847	news
630	早上連他們那所謂的早餐也不想去吃了.	3.429	4.429	0.904	0.904	hotel
326	那為啥國外會用新的引擎，而不用舊的？難道外國人比較喜歡嚐鮮？還是說比較喜歡解決問題？舊車殼也沒啥不好，為啥要換？又不是每個人都是大畫家，對於美感都非常重視...XP也沒啥不好，為啥要出Vista？說穿了，這就是人性...大家都對新的事物會比較好奇...而且會推出新的產品，一定有比舊的產品在某些部份有更進步的地方，不然就不用花費大量研發成本，去推出新產品了，就一直用舊的就好啦，廠商也樂的輕鬆...	4.667	6.000	1.054	0.926	car
1372	職棒球員表示，許文雄當時獲悉遭判賠違約金100萬元，曾表示尊重法院裁決沒有任何意見，但也顯示他無奈的心情和失意。	3.125	4.750	0.927	1.199	news
1655	雖然馬已拒絕召開國是會議，民進黨前主席蔡英文仍舊有所期盼。	5.333	5.000	0.471	0.756	political
1814	這次事情有因為死刑的存在而遏止了案件的發生嗎？反而恰恰相反。	3.667	6.125	1.155	0.781	political
1684	國民黨有一堆博士是事實，但這些博士總統、博士部長、博士縣市長是不是人才，卻值得懷疑。	3.111	5.857	0.567	0.99	political
