No.	Text	Valence_Mean	Arousal_Mean	Valence_SD	Arousal_SD	Category
104	這是一本非常值得推薦的一本書，我讀後收益頗多，並且已推薦給我的朋友，希望也能對別人有所幫助。	7.625	5.857	0.992	0.833	book
918	唯一美中不足之處在於我離店之後發現手機充電器遺忘在房間，打過去電話詢問前臺居然不知道此事，後經服務生及清潔人員仔細尋找才找到（其實就在插座上）。	4.500	5.250	0.5	0.661	laptop
2199	因為韻律，身體才不被削為物；身體空間的記憶，若滅了韻律部份，就有反生命的危險——以此觀之，羅浥薇薇是在倫理與才份上，雙雙俱足的守護者，珍稀且強悍。	6.250	4.750	0.661	1.09	news
23	書裏傷感的情節而落過淚感嘆唏噓但是這不是我要的每個人追求的愛情不一樣，有些感受卻是可以一樣的吧	4.222	4.143	0.916	0.99	book
1460	李俊俋收藏蛇領帶也是「低年級」的民進黨立委李俊俋，對蛇相當冷感，被問及對蛇有何感覺？他說，很少談這種東西，倒是有收藏一條蛇圖案的領帶，是在國外旅遊時發現的；因有關蛇的物品比較罕見、自己又屬蛇，覺得有趣纔買回來。	5.000	4.286	0.5	1.278	news
2877	全球行動通訊系統協會警告稱，設計拙劣的5G頻譜拍賣可能會嚴重影響5G時代的潛力，甚至在它真正開始之前。	3.556	4.000	0.497	1.563	news
724	太讓人失望了！	2.667	6.125	0.667	0.781	hotel
2595	每次碰到車子在路邊隨意亂停，光是開單拖吊，好像有點治標不治本，畢竟貪圖方便或是覺得自己不會那麼倒楣被抓的駕駛者多的是，只有真的讓車子沒法停，才是根本之道。	4.500	3.000	0.5	1.5	news
2306	網際網路正在發生分裂，各國家和公司很快將被迫對自己的網路未來做出一個嚴酷的選擇，即選擇西方模式還是由中國共產黨所建立的模式。	4.000	3.571	0.866	1.294	news
1038	張姓清潔員答辯時說，借調之前長官就說了不會影響獎金，事後卻任意更改勞僱契約、調整薪資結構，「要我退還已領的薪水，不只侵犯員工權益，更破壞人民對政府的信賴，實在鴨霸！	2.500	7.444	1.025	0.956	news
2019	人一生不要總求童年不幸的陰影面積，與其自怨自艾，不如去讀書吧，讀書可以治癒一切，你的所有疑惑，都能在書裡找到答案。	6.200	5.429	0.4	1.05	news
1225	孩子終究在少年媽媽的肚子裏，女方得與家人討論，做出重要的決定。	5.000	4.000	0.0	0.926	news
1895	日前臺北市長郝龍斌在月前表態支持阿扁保外就醫，並強調阿扁的保外就醫不單是司法問題，而是牽動許多綠營情感的社會心理問題，對於一個深藍且執政的人物，郝龍斌似乎捅了個馬蜂窩，幾乎被藍營罵翻了，但郝龍斌的這番話似乎僅點出了現況，殊不知更深的意涵就是國民黨對臺灣的另一種道歉方式，更是消弭藍綠對立的一種方式。	4.400	4.714	1.114	1.03	political
808	一氣之下我把它給拆了，應該是裝配問題，風扇運轉很安靜，是其他地方和它發生了共振或摩擦，從新裝了一遍現在好了。	4.143	4.571	0.99	1.678	hotel
1081	家庭不可碰觸的禁忌，憂心家庭經濟比率佔四九％，纔是親子間不可說的秘密。	4.125	4.556	0.599	0.831	news
682	晚上有小姐騷擾電話。	4.000	5.000	0.756	1.155	hotel
468	以數落豐田的不足來突顯你開福斯的優越只會搞臭福斯車主的名聲擁有如此極端偏頗的觀念沒有資格駕駛福斯批評豐田車主格局小自己卻是自我感覺良好的井底之蛙不尊重豐田車主你也該自愛保障一下福斯車主的尊嚴吧補充說明:你朋友照品牌車主僱人的方式絕對做不久因為比豐田車主更沒格局	2.750	6.286	0.661	1.578	car
522	這種狀況我最近也遇到，一位長輩在借開IS250上武嶺後，直接說買這種車真不值得，倒不如買Camry還比較舒適，他介紹好幾個朋友買camry，每個開過都讚不絕口	5.857	5.500	0.99	0.707	car
2307	與用於規避正常謊言檢測方法的技術不同，研究人員發現，接受腦成像謊言檢測測試的人可以通過兩種思維技術大幅降低結果的準確性。	4.625	4.500	0.484	1.732	news
2248	從美國進口中國科技類產品重點徵稅清單來看，新一輪2000億美元商品主要涉及計算機及零部件、通訊裝置、電視攝像機等。	5.000	2.143	0.0	1.245	news
1182	他對學習毫無動機和興趣，上課都在睡覺或鬧同學，我寫過很多次聯絡簿，也打了無數通電話給家長、去家訪，家長說她都知道，小孩打也打了，罵也罵了，送去安親班還被退貨，人家不收。	4.000	5.667	0.756	0.745	news
2319	曾以房仲為業的薛姓男子，今年3月起陸續在臺南破壞多輛電動機車Gogoro後被逮送辦，不改惡習，不僅持續作案，還跟蹤妙齡女子返家，遭斥責後亮刀恐嚇，昨晚被拘提。	2.333	5.500	0.943	1.118	news
306	還可以賣的那麼心安YO!!ALLNEWCAMRY新款的喔!讓人家感覺新的一定比較好如此行銷法手實在讓人不齒	3.000	6.000	0.0	1.069	car
947	解析度可以自己設定新的，方便遊戲。	5.571	4.750	0.495	0.968	laptop
494	別有一番駕駛樂趣。	6.000	5.111	0.0	0.567	car
1023	重要產業發展，電競優異成績是否可以比照其他競賽有升學輔導，雖然家長不見得喜歡小孩打電動玩具，但從長期發展來看，目前全世界有30個國家將電玩遊戲當成重要產業，臺灣也必須深刻思考，教育部會在三個月內提出相關辦法。	4.857	3.444	0.639	0.497	news
209	女作家和男作家的區別，在於擅長在邏輯嚴密和氣氛緊張的犯罪推理之外，對人性的軟弱、複雜和彼此之間可堪或不堪的關繫	5.444	4.625	0.497	1.409	book
754	讓人匪夷所思的是衛生間的門，居然是透明的，又不是情色酒店，入住的不是情侶只是朋友就算是同性也感覺怪怪的，沒有任何隱私。	3.375	5.111	0.484	0.875	hotel
1115	化名「浩一」的25歲青年，花了3萬圓（約9900臺幣）向東京一家便利屋租了兩位女性朋友。	5.000	2.625	0.0	0.696	news
1706	我們是中性的看待，試圖提出合理解決的方案，創造合理討論問題的空間」。	5.556	3.571	0.497	1.294	political
844	我在京東網買的華碩筆記本，第二天就發現嚴重的問題，無法使用。	2.875	6.333	0.331	0.745	laptop
2338	坦白說，我是耳根子硬的人，很怕被說一定要怎樣怎樣，絕對不可以這樣那樣，後來想想，與其顧慮一堆，還不如我自己來吧。	5.400	3.571	0.49	1.294	news
1496	因此在他們前進美國爭取世界冠軍前，很多人並不看好TPA能有亮眼成績，甚至臺灣內部都有很多質疑的雜音。	3.750	4.444	0.829	1.066	news
2616	在蘋果強推USB-C並砍掉3.5mm耳機插孔的情況下，協力廠商配件開發商貼心地為蘋果使用者提供了一系列的迂迴式解決方案。	5.875	2.250	0.781	1.299	news
2191	而且愈多計畫帶來愈多壓力，一旦某個計畫中的事情卡關，就會想要整個放棄，或是一直卡關在那邊，而整個計畫都往後拖延？	3.375	6.000	0.696	0.535	news
794	我住了5天，而且從沒提過中途退房，最後攜程告訴我酒店說我只住了2天就退房了，雖然最後是解決了，但很不爽唯一好得，酒店工作人員還比較熱情	3.875	5.625	0.781	0.992	hotel
1551	2012年十大新聞，由你決定誰最大條！	5.111	5.143	0.314	0.833	news
105	生活在紛繁複雜的世界中，要做到不抱怨是何等的不容易，但是《不抱怨的世界》它運用簡單的方法可以幫助你控制自己的語言，以至於將思想調整到正向，進而你將在無意識中改變自己的生命。	5.444	4.429	0.956	1.841	book
1855	國營事業有各種型態、種類及業務性質，尤其部分國營事業是在市場上和同業競爭，能否獲利，必須考量是否具備和同業競爭的條件因素。	5.125	2.714	0.331	0.452	political
1756	其中一人告訴媒體：「對以色列而言，這是很壞的消息。	3.778	4.625	0.916	1.218	political
1107	對華援助協會也對這一判決結果表示震驚和憤慨。	3.875	6.333	1.269	1.155	news
1283	楊典忠議員表示，近日不斷發生讓人痛心的事情，今年8月27日在北屯區大坑發生7只小狗集體遭毒死案件，聽說還有10幾隻沒被發現，以及8月31日在清水區信義新村發生4只小狗、1只小貓遭毒死案件，去年大坑光西巷附近也有30只小狗慘遭毒死，今年9月21日在豐原區翁子派出所也接獲毒狗案件，9月15日在霧峰區中正路還有小狗遭捕獸夾夾傷案件。	2.778	5.333	0.629	1.491	news
879	用了一個50元券，花了2649入手的，價格而言是無敵了，當然你要是3199入手，價格上就沒有優勢了，產品秉承了華碩的一貫品質，各方面做工都優於MSI的	6.200	5.375	0.872	0.696	laptop
2783	美中貿易戰一波未平一波又起，川普總統揚言將再對中國3250億美元商品加徵25%關稅，引發中國反嗆走著瞧，6月1號起，也要對美國商品加徵25%的關稅。	3.750	5.250	0.661	1.09	news
430	這樣講就會有人說命只有一條要買就要多花點錢買安全的車如果有錢可以買好一點的進口車開起來操控好爽度又夠又拉風誰願意開國產車?	3.778	6.667	0.786	0.471	car
2541	喬治敦大學隱私和技術中心的一份新報告揭露了紐約員警局面部識別系統的廣泛濫用，包括影像改變和使用非可疑影像。	4.143	2.889	0.639	1.595	news
2625	本週，他成為YouTube最新的惡棍，以創紀錄的速度失去了訂閱者，這完全是因為查爾斯恩師TatiWestbrook釋出的一段43分鐘的視訊。	3.375	4.300	0.484	1.269	news
568	實在是庭院深深，適合有車的朋友住。	5.500	5.222	0.5	0.416	hotel
2683	一，Youmustlikemeforme這句話節選自大家最喜歡的TaylorSwift的歌曲Delicate。	5.250	2.625	0.661	2.118	news
2311	和別人說著話、做著事，思緒卻不由自主地走神，過了好一會才回過神來；經常感到煩躁、不耐煩，對手頭的事情提不起興趣，特別容易分心。	3.500	5.333	0.5	1.563	news
958	外觀帥氣，精緻，顯示燈豐富，配置合理，VISTA下評分達到5.1，顯卡強勁達到5.9；各種模塊齊全，攝像頭藍牙都比較實用，音響效果的確不錯；之前大家關注的散熱問題，我也覺得滿意，北京那麼熱，我連續用半天，跟同學多臺電腦相比熱量沒他們的明顯，個人覺得大家不一定聽取某些人的片面抱怨，聯想還是值得信賴的大品牌；裝系統還算方便，隨機有VISTA驅動光盤，XP的可以再官網下。	6.625	4.800	0.484	0.98	laptop
1022	行政院長陳沖昨天表示，軟體產業很適合東方人，可將東方的歷史文化融入軟體設計，可以比照優秀體育選手服替代役方式來研擬。	5.556	4.143	0.497	0.833	news
769	急趕飛機，申辯無效後就氣憤的付錢走了這樣的服務態度，真讓人失望下次我應該不會再選擇它了	2.100	6.556	0.831	1.343	hotel
2744	Gogoro電動機車目前掛牌數突破1萬輛，車主數也突破15萬大關，目前全臺電池交換站約有近1200座，這也是第一起Gogoro電池交換站失火的意外。	3.833	5.333	0.373	1.106	news
2376	過去Google的旅遊相關服務散落在不同的地方，例如在Google行事曆或是Google地圖上，出現你訂位資訊。	5.900	3.200	0.943	2.04	news
1362	陳昱安被控於民國99年9月間因揣測父親對他偏心，不滿父親多次要求他外出工作，預先準備生魚片刀及菜刀，砍殺父親110多刀致死；歷審均依殺直系血親尊親屬罪，判處陳昱安死刑。	3.600	3.000	1.2	1.069	news
207	試試看的心情，買了一套，結果，女兒一看就喜歡上了，這套書的特色比較鮮明，每一本的主題對塑造孩子的優良個性都有	6.625	5.600	0.484	0.49	book
103	我想，就像書中所言：情緒是一種能量，會來也會走……這真是一次奇妙的閱讀經歷，更重要的是，這是一次久已缺失的心靈洗禮！	6.750	5.875	0.661	0.781	book
1236	寒假開始，桃園業者這兩天遇上好天氣，一天就湧入5000人，成長4成，春節更要衝1倍業績，雲林業者寒假搬出新設施，門票打66折，預估業績也能成長3成，樂園寒假搶客戰，正式開打。	5.778	4.750	0.786	1.199	news
535	我在高速公路上看過一台箱型車爆胎，還可以平穩慢慢的開到路肩，真的很冷靜.	5.250	4.500	0.968	1.323	car
2438	勇於挺身挑戰、捍衛自身尊嚴、不屈服強權與對自己專業充滿自信的官僚，也許正是柯文哲最想從日本民族身上全盤移植的。	6.143	4.429	0.35	1.05	news
1942	相信在雙方共同努力下，柬中友好合作關係必將繼續向前發展。	5.667	5.167	1.333	0.687	political
2206	當前IT公司為了爭奪優秀的技術人才，提供的各種福利都很可觀，除了極高的薪資，什麼免費餐飲、健身房、衣服清洗、桌上足球、各種下午茶與外出團建應有盡有。	6.778	5.375	0.629	0.857	news
1718	我很高興全美國都愛上第一夫人。	6.750	5.750	0.661	1.09	political
75	對自身健康的大概瞭解還是不錯的，總之，身體的健康還是要靠自己日常的保養保護，另外樂觀向上，保持健康的心態也是對身體健康最重要的。	5.714	3.625	0.452	0.857	book
1911	當然是下地獄啊所以囉，這個基督教徒之所以會這樣講，純粹就是怕因為自殺而下地獄所以牽拖掌權者，把自殺硬拗成他殺，他就心安理得，自以為可以進天堂了不過話又說回來，這人的所作所為挺貪腐/挺黑金/無腦反核/挺學匪)就算不是因為自殺而死，也絕對進不了天堂啊	4.000	5.250	0.866	0.661	political
1754	至於凱瑞，以色列也擔心美國外交政策在他主導下，將會使以色列在巴勒斯坦問題和約旦河西岸屯墾行動上面臨更多壓力。	4.111	4.444	0.875	1.343	political
2183	頸椎病是臨床常見病，通過合理、適當的運動可收預防和治療之效，但如果運動不當則可能會適得其反，引起或加重頸椎病的病情。	4.250	4.778	0.968	1.988	news
2493	就算別人說太瘋狂了，你也要勇於說出並面對狂野的夢想與抱負，這一點非常重要——很少有人在臨終時後悔努力追求夢想，但確實有很多人會後悔連試都沒試。	6.000	6.000	1.5	0.816	news
1497	8強賽，TPA首先要對抗世界排名第4的韓國代表隊NajinSword	5.444	4.000	0.497	1.069	news
770	不過在人性化設置上要予以改善。	4.000	3.667	0.0	1.106	hotel
1007	靜音，音箱效果還行，512M的獨顯	6.000	4.444	0.816	1.165	laptop
2346	值友9164898929結實耐用，讓貓咪玩的更歡樂~天貓精選實付5.9元包郵，近期好價，感興趣的值友不要錯過哦~	6.000	5.000	0.0	0.816	news
1280	其中一名男子隨後向吳宗憲示好，表示此事原則上要低調，不希望擴大，而李生原本表示暫不提傷害告訴，但下午又向中正一分局忠孝西路派出所提告。	3.778	5.333	0.786	0.943	news
1139	多數的臺灣網友樂見其成，稱讚臺灣終於出現可以與南韓「少女時代」PK的團體。	6.500	4.857	0.5	0.639	news
293	相信這才是車廠需要思考的方向。	5.750	4.714	0.433	1.278	car
2091	此外，這款平板電腦可與512GBmicroSD卡配合使用，是上一代機型可支援容量兩倍，但是其它引數保持不變，它甚至保持合理的49.99美元售價。	6.286	4.500	0.7	0.957	news
2356	美國密西西比一個州議員，嫌老婆脫衣服脫得太慢，他等行房等得不耐煩，把老婆痛打一頓，他吃上家暴罪，議會同僚和州長都要他辭職。	3.000	6.000	0.707	1.414	news
857	另外購買了聯想的X61T（朋友在美國帶回來的，*^__^*)嘻嘻……），所以想賣了臺1000HE，黑色的，原盒原京東包裝都在，如果是東莞的來看機最好，機子全新，貼了酷奇納米銀的鍵盤膜，絕對全新，發票單據齊全，京東給我的一樣不少，有意思的聯繫QQ282369262我手機13431221132	5.000	4.000	0.667	1.291	laptop
1722	「我知道選戰看似很蠢，很多評論員說這是特殊利益團體的較勁，如果各位能與參與造勢活動的人攀談，你會發現政治不只是表面這樣，你會發現年輕人透過參與，讓他們的後代能享受美好的果實。	6.111	5.429	0.875	0.728	political
397	不懂為什麼這種安全配備的車這麼多人想買單	3.250	5.778	0.661	1.133	car
726	呵呵，真誠感謝您的再次再次點評，我們相信在您的關注下我們會努力越來越好！	6.100	5.000	0.831	0.756	hotel
2115	一件爆款商品突然有了一個差評，在網上賣原創服飾的趙磊忐忑地聯絡了給出差評的買家，萬幸這不是一名職業差評師。	5.000	3.500	0.707	1.732	news
2359	毛嘉慶在臉書發表示，統獨是中華民國到臺灣後，歷史與政治的弔詭，民選總統後，演變為各不同立場政黨謊言交錯的政治算計籌碼。	4.625	4.625	0.857	1.654	news
2169	同為頂級前鋒，蘇亞雷斯32歲還在支撐著巴薩的鋒線，伊布37歲尚能在美國佔山為王，就連同齡的亨特拉爾，也跟著阿賈克斯煥發了第二春。	6.500	4.750	0.5	1.199	news
454	我鄰居買了一台U7，我問他使用經驗，他是說配備豐富，但是如果要買，建議我再等個兩三年，等這款車的問題修正後再買，不然.......。	4.400	4.286	1.114	0.881	car
1133	小龍迎春、旋乾轉坤、平安歡喜、新春如意。	7.143	5.500	0.35	0.764	news
1073	具中國籍人士能獲發我國護照的唯一可能性，是先在海外取得永久居留權，再向我國駐外館處申請中華民國護照；但外交部接獲申請後，仍會進行通盤考量，只有認定核發護照對國家有利，纔會同意放行。	5.556	3.714	0.956	0.881	news
818	入住時酒店的服務很好，大堂和房間一般，入住後發現房間的硬體較差，比如空調，馬桶，尤其是電視遙控器非常差，幾乎不能用。	3.000	4.571	0.667	1.05	hotel
2575	他們挖出了一批三年前埋在地下進行處理的生物可分解塑膠袋、普通手提塑膠袋，發現這些塑膠袋都沒有被完全分解，有一些甚至還堅韌得很，可以繼續裝載約2.3公斤的雜物。	2.750	5.875	0.433	0.781	news
1571	法等國憂AQIM攻擊歐洲法國和西方盟國擔憂AQIM會將恐怖主義轉移到歐洲。	3.333	5.429	0.943	1.05	political
1198	中職第四高，另外，合約還有高達600萬激勵獎金，若全數達成激勵高標，3年最高可拿到2400萬，等於平均月薪來到66.67萬，也僅次於陳金鋒，是中職史上次高。	5.333	4.625	1.155	0.992	news
2037	如果你是成熟的成年人，只有你才能評估這些東西到底是什麼，而評估的基礎是你個人的慾望和經驗，或許再加上與坦誠的朋友或諮商者討論。	5.625	3.778	0.484	1.227	news
2803	在新墨西哥州的沙漠中，相當於20000噸TNT炸藥的核武器，讓一朵巨大的蘑菇雲在距離地表近萬米的地方爆裂開來，最終在沙漠中留下一個10米寬的大坑。	4.000	5.333	0.894	1.886	news
832	大堂的服務員很熱情，有賓至如歸的感覺。	6.667	4.000	0.471	0.756	hotel
2540	近日，一起美國知名高校招生舞弊的醜聞爆出，揭露了幾十位美國明星和眾多華人富豪家庭向中間人支付?額，以獲得子女入學名校的資格。	3.111	6.143	0.737	0.833	news
1263	他們的部落格因此越來越受歡迎，許多狗友也會參考卡內的足蹟，再帶自家寶貝去玩。	6.000	5.143	0.866	0.833	news
1896	或許阿扁會深感時不我與，若在過去國民黨獨裁統治時期，不要說是貪汙，整個國家就是總統一個人說了就算，企業進貢還不夠，國庫通黨庫，數十年來國民黨黨產快速累積上千億元，至今信託後仍有數百億元，這些錢裏頭究竟有多少是臺灣人的民脂民膏？因此若要說貪，國民黨似乎還不夠資格，而這也是藍營極不願意真實面對的事實。	3.250	6.333	0.433	0.816	political
2535	日前，知名爆料網站slashleaks曝光了一張魅族16Xs多彩塑膠外殼照片，並給出了100%的可信度。	5.375	3.750	0.484	2.385	news
2313	他指出，港鐵去年再在其他兩個連線縫發現相同情況，相關檢查及測量申請表格亦缺失，港鐵就事件多次向禮頓發出不合格報告，並要求禮頓拆除及重建。	3.333	5.333	0.471	0.943	news
1435	「新的一年大家都不看好他們，但彼此的長輩都有支持的力量在，反倒是王心淩，今年追求她的可能不一定只有姚元浩，她是否能堅持，能決定他們愛情的運轉。	5.444	4.750	0.831	1.09	news
1767	老實說我個人是寧願整天打魔獸三國累了就玩LOL也不會想要當縣市首長跟立委之類的耶畢竟中路司馬玩得好的話一次星落可以打到對面五個英雄算是很好玩的遊戲當縣市首長跟立委感覺競選很累之後公務繁忙	5.000	3.167	1.0	0.898	political
1954	醫院裏的這些媽媽愁眉苦臉，她們好不容易懷胎10月生下的寶寶，輸在人生的起跑點上，每5個就會有1人死於營養不良；阿富汗兒童吃不飽，遠在南美洲的哥倫比亞，也有原住民兒童陷入悲慘童年。	2.200	6.000	0.872	0.866	political
2486	這最終成為了一個名為騰訊微信的創新與敏捷的商業案例，正式進入倫敦商學院戰略與創新課程，在本週第一次上課。	6.000	4.625	0.0	1.932	news
1749	小弟深深覺得激情或衝突並無法訴說要求或解決問題.	4.000	5.625	0.707	0.484	political
1638	居壓倒多數的人民在天性和態度上是如此的脆弱，以致用嚴肅的推理還不如用情感更能支配他們的思想和行動。	4.714	3.714	0.452	0.881	political
749	早餐很不錯，去周邊主要商業區也不遠。	6.444	4.111	0.497	0.875	hotel
1558	西拉伊特說，法官的職責是保護婦女兒童合法權益。	6.000	4.000	0.816	0.866	news
2790	最近有一名網友表示，自己的父親愛吃檳榔，但此不良嗜好會對口腔造成影響，因此他便決定幫父親戒檳榔癮，用小黃瓜與紅色芒果乾製作出健康版的檳榔，讓網友直呼太有才。	6.857	5.500	0.639	1.384	news
2529	點贊是社交網路裡最美好的部分，每當代表點讚的小紅點彈出，都意味著我們獲得了來自別人的認同、共鳴、讚許……真的嗎？	4.444	4.625	0.831	1.867	news
1931	災區正辛苦重建，臺灣朋友的支持及援助超過物質上的意義。	6.875	6.000	0.331	0.577	political
125	力所承受的艱辛對安樂死也有些瞭解，最後章節的那句我們已經不再相信壞運氣了，壞運氣不存在，運氣不存在。	4.750	4.000	0.433	1.069	book
2267	車到了，簡單說幾句內飾比我想像的好，當時驗車的時候買看著在太陽下曝曬的新車簡直佛了，坐進駕駛艙感覺還可以，比不上E級，但是感覺打平5系問題不大。	6.000	4.833	0.756	1.572	news
841	同事裝的另一大牌本本好多了，bios基本等於廢物，無隨機驅動，網站上只有Vista驅動，跟客服聯繫多時才搞到驅動，還特別自己集成了一張帶SATA驅動的XP安裝盤才裝上，費了很多精力。	3.800	5.833	0.872	0.373	laptop
1613	中評社指出，中國的這些反制動作再次表明，美國的武力威懾措施並不湊效，不管美國採取何種武力威懾措施，中國都不會懼怕，中國會堅決維護領土完整。	6.333	6.778	1.247	0.416	political
2089	不久前微軟給PC玩家們帶來了一個非常好的訊息，原本以主機為主要服務物件的XboxGamePass訂閱服務，現已確定會擴充套件到Windows10平臺上。	6.125	3.750	0.599	1.561	news
2863	第三屆世界智慧大會智慧科技展和體驗區準備就緒，智慧科技展和體驗區展覽體驗總體面積將達到近6萬平方米，彙集了國內外智慧領域的先進技術成果。	6.286	4.286	0.7	1.03	news
526	請注意且小心的操控它！	5.125	5.556	0.331	1.066	car
2168	效力於勒沃庫森的左後衛溫德爾曾經在一次採訪中透露過自己防守羅本的策略，他說如果所有體面的防守辦法都無效，他就會被迫使一些小伎倆。	4.667	3.857	0.471	0.99	news
314	還有，最不期望的就是這種比爛的砲火！	2.500	7.500	0.5	1.0	car
2204	分析稱，貿易戰既可以成為特朗普贏得大選的決勝籌碼，也可能演化成他的弱點，關鍵取決於貿易協議達成的時機和力度。	5.000	2.444	0.0	1.423	news
193	人類要實現生命的永恆就有超越死亡。	5.125	4.125	0.331	0.927	book
741	住過的最差的之一１．房間極其悶，在高原本來就缺氧，悶在房間裏極易加劇高原反應；２．簡陋。	2.667	6.714	0.471	0.452	hotel
1969	公民監督國會聯盟常務理事顧忠華也表示，執政黨在年終慰問金和國營事業績效獎金上「預留空間」，讓人懷疑未來恐以「選票考量」來推翻本屆會期立法院所做出的決議，這是以拖待變，有欺騙的嫌疑。	4.000	5.375	0.816	1.495	political
1877	鋼盔也要油電雙漲，今年起勞健保也漲價，人民是總統的頭家，頭家都生氣了，公僕卻不在意；以前發生重大事件都有官員負責，如今人民生活難過，卻沒有官員下臺，這個政府完全是無感、無責任。	2.571	6.200	0.495	0.748	political
