No.	Text	Valence_Mean	Arousal_Mean	Valence_SD	Arousal_SD	Category
1955	CNN記者：「其中69%被抓的小孩，年紀是在14歲以下，最年輕的甚至只有8歲，98%說他們受虐或是親眼目睹過施虐暴行。	2.600	5.714	1.2	0.452	political
210	小說更對女性在“法醫”這一“男性”職業之種種身心壓力、人際壓力、規則壓力的包圍下，如何堅定地維護正義、呵護親情和愛情，進行了細緻入微地表現。	6.000	4.625	0.775	1.317	book
2108	即使僅僅按照瑞幸2018年2.4億美元的淨虧損速度，不考慮它維持增長需要增加的投入，也不過是支撐2到3年的時間。	3.111	4.556	0.875	1.165	news
995	電池不是原裝，我懷疑是水貨	3.111	5.167	0.737	0.898	laptop
701	酒店的泳池還不如比它小的酒店漂亮。	3.600	3.833	0.49	0.898	hotel
541	首先非常感謝您選擇東方大酒店，也非常感謝您給我們提出了寶貴的意見，酒店近期樓頂正在加層建造西餐廳	6.125	3.833	0.331	0.898	hotel
1716	另外，歐巴馬展現自己愛家的一面。	5.778	4.125	0.629	1.166	political
9	書中攝影作品以及文字都向讀者呈現另一個完全不同的時空，我想熱衷於此苦旅之樂的人們，受得起苦，覺得萬分值得的也是這一份精神體驗的快樂。	6.333	5.625	0.471	0.484	book
1074	外交人士透露，我方對中國僑民申請護照的審覈相當嚴謹，「申請人大概要是諾貝爾獎得主纔可能成功吧！	4.125	4.167	0.927	1.067	news
1451	非客家籍的郝市長以客語致詞，博得臺下鄉親們的掌聲鼓勵。	6.556	5.444	0.685	0.831	news
2462	有個男人，少年得志、放浪形骸、花天酒地，在人生路上跌一跤之後，沈潛十數年，突然對一位條件很好的女性展開追求。	5.400	6.000	0.49	1.414	news
594	早餐嗎？別說可口和品種多樣了，不誇張地說，連填飽肚子都成問題，不行你就去試試！	3.143	6.857	0.35	0.639	hotel
2569	立法會祕書長陳維安昨主動解畫，重申祕書處一直以來恪守不偏不倚的原則，惟部分人的批判言論近乎欺淩及滋擾，對祕書處極不公道，望有關人士停止攻擊。	3.375	5.750	0.484	0.829	news
370	影音設備...這個部分有改善。	5.444	2.889	1.423	0.737	car
2296	蘋果的回答是肯定的，從去年下半年開始，蘋果頻頻對外釋出向服務轉型的訊號，甚至在今年的春季釋出會上，徹底拋開硬體，全力宣傳其流媒體和金融服務。	5.778	5.333	0.416	0.667	news
201	怕再次傷心，上次看完，之後的一個禮拜我都沉靜在那揮之不去的心痛和傷感中，但是這次還是不由自主的翻開了，也許一切都是命運的安排，凝夕和司夜兩個就像夕陽和夜晚，永遠不能共存，兩個不懂愛的人在彼此的傷害中感受愛，也許從凝夕出生開始她就註定要像櫻花凋謝那般死去~~美麗還慘烈.....	3.250	4.625	0.829	1.728	book
250	所以英諾森提的插圖本身就是宏偉圖畫，值得慢慢品味。	6.333	5.250	0.471	0.829	book
2911	賴清德說到，他對黨主席卓榮泰很欽佩，面對27位中執委提案修改選舉辦法，他有道德勇氣維護黨的制度，站在制度面。	6.375	5.500	0.484	0.707	news
875	我是3699購買的，呵呵。	5.625	4.571	0.857	1.05	laptop
80	而且這書中英對照，也可以對小朋友灌輸一下一些簡單的英文。	5.778	2.875	0.786	0.331	book
2192	網上有打工仔就面對兩難局面，佢從事IT工作，突然被問有冇興趣返內地打工，工作地點係三?城市邯鄲，冇地鐵要?車，做IT程式開發員??	5.167	3.750	0.373	2.385	news
1892	政壇的敏感神經，而結論不就是希望阿扁能夠保外就醫，最好是能夠獲得馬英九總統的特赦，恢復阿扁的自由之身。	3.875	5.625	0.927	0.992	political
106	不足之處：沒有對部分比較難的單詞做出註釋（有些詞一般的字典是查不到的）。	4.100	4.111	0.831	0.875	book
2853	雖然微信的功能開放比較克制，不過微信支付的協力廠商服務卻動不動搞個小動作，目前協力廠商服務已經多達12個，比騰訊自家的9個服務還要多。。	5.571	3.286	0.904	1.278	news
88	我希望每一個愛讀書的人，都能好好看看這方面的書，推薦給親朋好友也看一看，讓每一個人在生命受到威脅時都能做出正確的選擇。	6.600	5.444	0.49	0.685	book
868	機器運行狀態有些電源等等的白色指示燈很漂亮內置話筒和攝像頭視頻比較方便人性化的設置比較多如開機狀態在電源插入和拔出的時候有警告聲易於控制工作時間靜音鍵快捷導航鍵等等還是有一些比較出色的UE方面的設計發熱量一般有好幾種電源模式可選送貨速度快服務好	6.500	3.750	1.118	1.561	laptop
45	這無可厚非，人應該先愛自己，才能去愛別人。	5.429	3.500	0.495	1.323	book
2644	Facebook表示，能吸引使用者重複觀看的視訊會有更高的優先順序，同時觀眾會乖乖觀看最少一分鐘，甚至3分鐘的話，更會有更高的權重。	5.250	3.556	0.433	1.257	news
725	酒店只會對客人不好的點評做出辯駁，這樣的酒店還有生存知道嗎？難道堂堂掛六星的酒店（根本就不是國家旅遊局頒發的）就是以這樣真誠的態度回饋你們的客人嗎？其他的就可想而知了。	3.111	5.667	0.737	1.106	hotel
330	壓縮機使用電子可變開關控制	5.125	5.000	0.331	0.632	car
1948	營養不足，嚴重發育不良，3歲小孩骨瘦如柴，看來來像1歲多。	3.111	4.600	0.737	1.02	political
2962	AMD的7nm產品矩陣已經蔚然成形，雖然Intel仍舊慢半拍，但NVIDIA方面似乎不願再被動挨打了。	5.333	3.143	0.745	1.641	news
1856	陳揆強調，各部會所屬國營事業績效情形差異甚大，負擔的政策任務輕重也不同，應相對給予不同考量，包括考績與考成獎金是否重迭、同一機構內績效獎金差異及政策性因素的合理性等。	5.111	4.625	0.314	1.576	political
85	不愛的時候按個手機號碼都嫌費力。	3.375	5.286	0.484	0.452	book
357	呵呵~傻眼了阿~!!如果整天要怕死的怕自己開車去撞人的可以考慮前面幾位大大所推的!!本人只怕別人來撞我!!我希望前面某些人出車禍時.	3.889	5.333	0.875	1.491	car
991	國貨好幾年了，但是黑迷們始終認定人家是IBM的東西這一點倒是可以確定，技術上，無論硬體軟件	5.125	5.286	1.166	0.7	laptop
2404	不可避免的，這種模式容易出現騙局，雖然從業者都是精明人，但欺騙者通過長時間的正常交易獲得信任之後他們也可能會麻痺大意。	4.000	2.875	0.707	1.536	news
55	長恨歌，我想王琦瑤只是追求自己的幸福，從李主任時是青春追求名利，康明遜時追求的安穩的生活，老克臘追求的晚年孤獨的陪伴，只是她的追求都破滅了～我想如果程先生沒有在文革的時候自殺了，也許晚年的王琦瑤就會願意了吧，願意只有恩情而沒有愛情的陪伴了吧～很不錯的一本書～王安憶說過，她筆下的王琦瑤代表的是一座城市～值得一看哈～	6.111	4.750	0.994	1.199	book
1772	真的很簡單馬英九這輩子做過四件最惡毒的事情，第一件惡毒的事情選贏陳水扁，重點是讓他沒連任太惡毒了.	3.000	5.500	0.0	1.118	political
2363	任正非之女、華為前CFO孟晚舟被加拿大扣留，5G裝置在海外遭到美國及其盟國的地址，穀歌完整版安卓系統又禁止華為手機使用。	2.857	5.429	0.833	0.495	news
2714	一隻最新被發現的困在琥珀中的小千足蟲已經有9900萬年的歷史，這隻千足蟲在接近一億年前被困在緬甸，他被發現時依然處於白堊紀時期形成的琥珀中。	5.500	4.125	0.5	1.452	news
2600	要分享到網路上的照片或圖片，甚至是因應工作所需，必須將圖檔傳送給他人之前，最好都可以蓋上浮水印，除非你不介意別人隨意使用。	5.143	4.111	0.35	2.233	news
2496	民建聯議員陳克勤認為，民主派不擇手段阻止會議，即使召開法委會亦無法運作，若成立專責委員會，可以參加的議員不多，未必可行。	4.000	3.250	0.0	1.09	news
2131	這部奇幻背景電視劇的最新一集，在打敗夜王之後主角們聚在一起進行慶祝，但龍女王DaenerysTargaryen面前的桌子上卻不合時宜的出現了一個星巴克咖啡杯。	4.714	2.429	0.7	1.678	news
1966	北韓中央通訊社在報導中強調：包括北韓領導人金正恩和勞動黨、政權機構、以及社會團體，在春節之際，就前往平壤「萬壽臺」，向「金日成和金正日父子」的銅像前，獻花拜祭，表露了真情和忠誠。	6.111	4.250	0.875	1.09	political
1592	國營事業員工績效獎金，確定維持一.二個月上限，今年之內無法翻盤。	4.200	4.778	0.872	1.133	political
1483	老虎隊8局上攻勢再起，DelmonYoung先開轟幫助球隊擴大比數，下一棒JhonnyPeralta也揮出二壘安打上壘後，AvisailGarcia打出2人出局後的適時安打，老虎隊此局再下2分，形成4:0的領先優勢。	6.333	5.667	0.471	1.247	news
2822	天貓此款目前售價2209.01元，待6月1日0-2點下單立減551元，到手價1653元包郵，直降好價，預定有禮品，需要的值友可關注~	6.286	4.500	1.03	2.345	news
874	外觀不錯，很適合MM用。	6.400	5.778	0.49	0.629	laptop
2454	北韓領導人金正恩嚴厲批評美國前副總統拜登，美國總統川普今天加碼支援金正恩，並駁斥外界指稱他和獨裁者金正恩沆瀣一氣欺負自己同胞的負面批評。	3.750	5.875	0.661	1.053	news
1246	此番發言引起與會中方人士不滿，演講嘉賓之一的前中國國防大學戰略研究所所長潘振強迴應，穀內的發言「粗暴、狂妄，顛倒黑白、混淆是非」，讓他感到吃驚和悲哀。	3.286	5.625	0.452	0.857	news
1128	馬總統表示，新的1年，他心中有3個願望，希望經由他和全民共同努力，打拚出臺灣新氣象。	5.889	5.571	0.737	0.728	news
498	好吧講其中一個理由我認為一台1.6噸的車子油耗只有14KM/L	4.625	5.143	1.111	1.125	car
1065	除了國內最高榮譽，由德國專業航空機構AEROInternational每年透過德國權威數據評估中心（JACDEC），針對全球八百多家航空公司之飛行年數、近十年來重大意外事故件數統計，及近三十年來航機失事件數等基礎進行評比，甫於十八日出刊。	4.714	2.800	0.452	0.748	news
8	推薦給我的兒子、朋友們。	6.750	5.000	0.433	0.866	book
1909	劉耀仁指出，所有與直接執法無關的人員都不應領取罰鍰獎金，因此，明年共編列一億六千一百多萬元道安獎勵金預算，應刪除交通局所屬單位四千八百多萬元預算，交通大隊分食二十八％罰鍰獎金的內勤主管共三千一百多萬元也應刪除，如此一來，市庫將增加八千萬元收入。	5.889	3.857	0.875	0.833	political
455	Toyota剛好相反，第一批一定用料最好，後來才會慢慢Costdown。	4.875	4.000	0.781	0.926	car
2135	穀歌表示，透過ARCore動態追蹤、光線偵測和瞭解現實世界的能力，這四個傢夥於AR場景中的呈現將會十分逼真。	6.000	3.222	0.943	1.931	news
1912	替輸家出頭，只有造成社會動亂，大埔張老闆嗝屁了林家也拆了!贏家也被搞得不爽..更扯的是，他們還想將所有人帶到輸家那一方為什麼員警還不趕快將這兩人帶走，關到綠島去呀!跟有競爭力的贏家站在同一邊不是比較好嗎?	4.625	6.286	1.495	0.452	political
15	我們的生活中也需要激情，在小說當中會找到我們也曾有過的戀愛的感覺。	6.000	5.000	0.775	0.667	book
1533	回想成長過程，不管是生活方式、學校或工作，受到父母期望而下的決定不勝枚舉。	4.000	4.556	0.926	0.956	news
2159	為了修復不亞於Wannacry的RDP服務漏洞，微軟於今天面向包括XP在內的上述系統釋出了緊急修復補丁，要求使用者儘快完成安裝。	4.667	5.250	1.247	1.479	news
2022	但超輕薄筆電在方便攜帶與優異的電力續航的背後，通常也意味著因為機身更為緊湊，因此不得不犧牲掉筆電本身的擴充性。	4.000	3.000	0.0	1.491	news
2739	食環署人員今午以電擊方式撲殺，有動物保護團體到場抗議，質疑豬隻未被人道撲殺，又批評當局連日來與業界協商期間，沒有善待豬隻。	3.375	4.100	0.484	1.446	news
2952	不料2人心生歹念，聯合另外2名男子偽造哥哥是某公司董事長的假像，還偽造1張1億元的本票，想趁機詐騙自己的父親，最後詭計被識破。	3.111	4.375	0.737	0.992	news
1687	越南這是要玩死自己嗎？越南最主要的投資方來自中國大陸臺灣香港新加坡這些勞動密集型的產業最大的優勢就是工資低廉便於馴化這樣的暴動是明明要把自己搞死啊越南一直以來學習中共用“民族主義”來激勵人民現在這個民族民粹要害死越南人.	3.111	5.571	0.875	1.178	political
653	事後酒店方面承認防盜壓力很大，而且屢有客人失竊。	3.667	4.750	1.333	0.968	hotel
197	當我們看到別的孩子的優秀之處時，往往會很羨慕，有時還會忍不住責備孩子：“看人家”，可是我們有沒有想到他的媽媽在背後付出的努力。	4.222	5.625	1.03	0.484	book
981	東西不錯，烤漆面漂亮，機器運行穩定，速度快。	6.889	4.750	0.567	1.09	laptop
403	這篇文章跟福特有關係嗎？孤鴻海上來你真的很會硬凹捏各國強制安裝的安全配備，如同安全帶一般只有台灣政商牛步，還是說你跟他們有一腿？擁護T牌到這種程度，也真有你的畢竟花錢買Toyota的是別人，也不是你對吧？別人家的小孩死不完如果因為你一句話讓其他消費者對安全性有了錯誤的決定甚至間接導致未來事故的發生那業報是一輩子都還不完的	3.000	6.444	0.5	0.685	car
1211	另外，想送給父親的女性高達四十四．三％，讓日本老爸難得能在男友面前揚眉吐氣。	6.375	5.500	0.857	1.118	news
921	也請管量員不要刪了，給大家一個機會，大家好纔是真的好！	5.625	5.375	0.484	1.495	laptop
759	千萬小心使用。	5.125	5.833	0.331	1.067	hotel
2380	一個朋友和我說，自己也嘗試過單獨出國旅遊，但旅程中真的覺得很寂寞，完全不像想像中那樣豐富精采，懷疑是不是自己做錯了什麼？	3.333	3.444	0.667	1.165	news
946	人品還行，完美屏，內存三星，硬盤西數，螢幕也是三星的。	6.000	4.500	0.816	1.225	laptop
472	換個角度看有些冷門車的車主自以為很有品味很懂車那些人的車在別人眼裡可能比toyota更像垃圾	3.250	6.250	0.433	0.968	car
1206	您寫的太好了，讓人有興趣學會計。	6.667	4.667	0.943	1.054	news
2395	十一種口味可選，味道鮮美，適口性強，狗子愛吃~京東目前售價12.9元，下單3件，可參加買3免1，實付25.8元包郵，摺合8.6元/件，需要的值友可以入手~	5.625	3.500	0.484	1.323	news
2142	我們在做安全教育的過程中也發現有不少的老師認為倒立控水是對的，民間的辦法裡甚至還有對溺水者掐人中施救的。	5.000	3.750	0.577	2.107	news
79	看了一下，書的質量挺好的，裏面的圖畫也挺吸引小朋友的，都是小熊，小兔，小松鼠之類的小朋友都喜歡的小動物。	6.667	6.143	0.471	0.639	book
2390	iOS–AppStore連結Andoird–PlayStore連結不過遊戲現在限時免費，裡面還是有一些內購要素，不過免費也可以很爽玩～一樣強烈推薦大家！	6.857	7.571	0.639	0.904	news
2519	經歷了長時間的文藝為政治服務，人們驚歎於星星藝術家的自我表達，他們畫普通人的肖像，普通的風景，手法不太寫實。	5.000	4.167	0.707	1.067	news
1334	在創新發明的過程中，吳信達老師說，需要投入許多時間與精神，但是他感謝許多人的一路相伴與支持。	6.250	5.429	0.661	0.495	news
1637	FB上看到下面這段話，實在是令人毛骨悚然。	3.222	4.714	0.416	0.7	political
2374	代表律師今早在高院求情指，患精神分裂症的被告在港無親無故，唯一擁有的只是微小的?房單位，他卻長時間遭死者侮辱和欺淩，其處境值得同情。	3.250	5.429	0.433	0.495	news
890	裝個XP，結果好像是沒有安裝合適的驅動，所以打魔獸爭霸都卡的要命，打華碩售後服務，原來在官方就沒有針對XP的驅動，大部分都是VISTA下的驅動	3.375	4.667	0.484	0.745	laptop
2879	日本仙台市一名遭家暴的七歲男童，獨自跑到警局求救，警方發現他全身傷痕累累，發現他被狠心父親踹肚子，還被整個人壓著撞地板。	1.875	7.857	0.781	1.125	news
513	之前在汽車百貨看到這隻司柏奈)德國油在台分裝在特價188，想說俗俗買來用用看~起步輕快引擎聲變小但太黏尾速縮掉了還有清潔性不佳聽朋友介紹下~用了力豹仕~真的好用~拉轉力道猛爆~可惜油耗差了些跟其它牌10w40的機油比)後來看到倉庫賣的agip5w40~忍不住又想買來玩玩看~還蠻省油的~倉庫賣的比汽車百貨便宜好多~好賣家^^這幾隻油是我用過還不錯的~貼上來讓大家看一下	6.750	5.625	0.433	1.218	car
1260	網路上一隻小有名氣的柯基犬「卡內」，主人經常在BLOG分享願意讓狗進入的友善餐廳，但絕對會附上一張「告示」，宣導帶狗上餐廳的禮儀。	5.750	4.571	0.661	1.05	news
2916	畫框裡有時是綠色苔原，襯著冰山；下一分鐘，來到一片雪白大地，無邊無際；有時遍佈黑色的火山熔岩，還以為來到月球表...詳全文	5.375	3.875	0.484	2.26	news
1904	真是好笑，這種人口口聲聲說民主但是卻無法容忍跟自己想法相反的聲音八卦版也是，只要發一篇支持服貿或是批評這次學運的文，就會被貼上黨工或是抹黑的標籤，反之在那邊酸政府的人就酸的很開心。	2.750	7.125	0.433	1.053	political
549	酒店位置挺好，服務生態度很好，早餐很好。缺點:房間居然不能上網，酒店工程師說是swtich壞掉了，從下午到晚上11點都沒有修好，失望。	3.400	5.625	0.49	1.317	hotel
644	酒店大堂環境不錯358的房價還是物有所值，辦理入住很快很順利，讓我心情級差的是前臺結帳時服務員的傲慢和冷漠態度讓人不敢恭維！	3.000	6.500	0.0	0.707	hotel
2492	最直觀的演戲用力過猛就是把所有在表演中的情緒放大，比如說話語調提高，哭或者笑的表情幅度誇張，戲劇衝突的表演點在語言和肢體上過於猛烈。	4.778	3.778	0.629	1.812	news
217	目前小弟仍在茁壯的階段，我的服務一直都是積極的！	6.750	6.125	0.829	0.927	book
1390	有多少小孩子們用他們的生命和青春來成就貴公司，多少孩子們將他們的未來押注在你們所創造出的虛幻世界。	4.000	6.375	0.667	0.857	news
1021	臺灣電玩競賽隊伍臺北暗殺星TPA)在電玩大賽英雄聯盟世界錦標賽奪冠，電玩產業引起重視，教育部將在3個月之內提出優秀電競選手升學及獎學金相關辦法，激勵今16)日遊戲股全面大漲，擺脫近期低迷的悶氣，由華義3086-TW)領軍攻頂，其中昱泉6169-TW)、網龍3083-TW)隨後亮燈漲停，智冠5478-TW)、宇峻3546-TW)漲幅超過5%，辣椒4946-TW)、樂升3662-TW)、傳奇4994-TW)、歐買尬3687-TW)、鈊象3293-TW)及橘子6180-TW)也都有3%以上漲幅。	6.375	4.857	0.857	0.833	news
2882	哈哈哈哈哈哈哈哈笑死了，昆汀線上說牛B，還說自己現在不是牛B而是OldB，最後又突然冒出來一句傻B，他從哪兒學的這麼多！	5.750	6.000	1.392	0.926	news
161	我的確看得很過癮很開心！	7.125	6.250	0.331	0.968	book
2340	這款創新的織物鋰電池能量密度高達超過450瓦時/公升，柔軟度極佳，可摺疊彎曲至半徑小於1毫米，即使摺疊超過1000次，其效能仍然保持不變。	5.889	2.889	0.737	1.449	news
1941	她表示，施亞努太皇是中國人民忠誠的老朋友、好朋友，幾10年堅定奉行對華友好政策，並長期在中國生活居住，中國是施亞努太皇和我的第二故鄉，中方一直給予我們精心照料，施亞努太皇病發後，中方有關部門全力救治，我對此深表感謝。	6.889	6.167	0.567	0.687	political
2102	根據一些現任和前任蘋果員工的說法，蘋果零售店越來越注重品牌推廣而不是滿足購物者需求，導致消費者對一些商店提出更多投訴。	3.500	5.111	0.5	1.197	news
523	唉~又是一篇無聊的酸文！	3.222	5.500	0.416	1.323	car
1191	如果老師可以透過通報，讓學校強制對疑似可能有狀況的孩子鑑定，透過社工系統介入，纔是真正的保障學習權。	5.875	4.125	0.599	1.269	news
1385	高雄鳳山這場大火困住一家10口，3人自行逃出，還有7個人受困火場，就在11歲的小妹妹被救出時，一度出現找不到救護車的窘境，救護人員搶時間跑了200米，還好最後是巡邏車接力應急，這也引發救護車不夠的質疑，消防局表示，他們在第一時間出動了3輛救護車，比臺北市標準流程1輛還多，只是沒想到受困人數太多，一發現就緊急增派，順利將傷者送醫，並沒有延誤。	3.714	4.333	0.881	0.943	news
247	希望我能夠永遠有童心，永遠在夢神奧列傘的世界裏遨遊！	6.500	5.714	1.025	0.881	book
2419	假如你恰巧是品牌或通路的經營者，那殘忍的瞬間，代表原本屬於你的顧客被對手狠狠攔截，線上上與線下區隔日漸模糊的今天，這是大家正在面對的困擾。	3.875	5.286	0.781	1.161	news
2497	張建宗表示，希望部門首長對富爭議及重大課題，有充分掌握，尤其坊間眾說紛雲，會議純粹是解說、澄清並加深瞭解。	5.000	3.222	0.816	1.618	news
1597	績效獎金召開臨時會，但要求刪除「不再行處理」字樣，其餘皆依上週結論辦理。	4.889	4.286	0.314	1.161	political
2810	面對中國面板廠快速擴充產能，專家說，南韓面板廠轉型有機發光二極體面板，臺廠則固守液晶面板，鎖定迷你發光二極體背光源產品因應變局。	5.571	3.143	1.05	1.457	news
305	擺明仗著牛頭牌光環，仗著銷售量高這樣對的起你的支持著?	2.556	6.889	0.497	0.737	car
252	第三者，逝去的四年的時光留下的也不會是愛情，只是對於年少的懷念。	4.556	4.571	0.497	0.904	book
251	強烈推薦給不喜歡速食閱讀的朋友，推薦給追求認真做事的朋友讀，推薦對插畫有高要求的朋友。	5.875	4.250	0.781	1.199	book
2065	平心而論，Google有這項服務也許是一件好事...但不主動告知有這樣的功能導致容易造成使用者不必要的誤會。	4.000	4.222	0.781	1.199	news
813	心中對這家酒店的感覺一下就十分不好。	3.375	5.167	0.484	0.687	hotel
2439	日本和韓國長久而來因著戰爭和殖民歷史而有矛盾，雖然近年日本官方極力阻止軍國主義勢力抬頭，但民間仍然會出現這些聲音。	4.375	4.111	0.484	1.449	news
1521	王位同學來自單親家庭，由母親打零工維持家計，王位同學擔憂母親身體健康於是半工半讀幫忙負擔家計，勇於面對這一切拂逆之狀況，也成他獨立自主的個性。	5.333	4.000	0.943	1.5	news
2468	而更令玩家動心的是，G502Lightspeed支援LightsyncLED，能夠以酷炫的燈光來配合你的遊戲操作。	6.143	5.625	0.35	1.576	news
2590	一名在學術期刊等公共平臺發表了高達200多篇論文的日本麻醉醫師──藤井善隆，被抓到長期偽造資料，並有高達183篇論文遭到撤稿，且數量仍持續增加。	3.143	5.000	0.639	1.414	news
313	可以沾點光來提醒大家對安全配備的重視！	5.556	5.500	0.685	1.118	car
2357	因此，有任何男性讀者覺得精進學習兩性相處的智慧很重要時，我就會覺得你好棒，心態上已經領先大部分男性囉！	6.500	4.625	1.0	2.497	news
2855	雲林縣警局北港警分局土厝派出所所長陳連益、警員楊子誼，日前執行巡邏勤務時，在水林鄉水林路發現失竊贓車，遂依法予以攔查，清查後發現竊嫌另涉2起竊案。	4.429	4.429	1.05	1.294	news
320	我是2010年3月購入的，近一個月我的車也開始發現有冷氣開啟異味（酸味）問題，看來這問題並不是個案，和泰應該重視並給消費者一個滿意的說明和提出積極有效的解決方式，而不是任由保養廠以一些無效作法暫時安撫消費者，如無持續善意解決，恐又要演成集體消費糾紛事件了，相信亦非和泰公司所樂見。	3.000	5.833	0.0	0.687	car
1377	江嫌於地檢署復訊時，表情木訥，直說壓力很大，江妻在旁強調先生因照護母親和家庭壓力過大纔會鑄下大錯，事發後「家裏更需要他」，會陪他走出陰霾。	3.375	3.625	0.857	0.857	news
2152	從功能上，作為智慧手錶的GalaxyWatchActive的運動訓練模式非常豐富，足以滿足絕大多數使用者對於運動資料的監測需求。	6.222	3.556	0.416	1.165	news
2554	如果你問前幾年的我，我是一定會拒絕冥想這種活動的，畢竟坐在那兒一動不能動怎麼看都是一件無趣又無用的事。	5.000	3.300	0.667	1.616	news
1457	蘇震清抓蛇好本領從小練就一番徒手抓蛇的好功夫。	5.889	4.286	0.567	0.881	news
