No.	Text	Valence_Mean	Arousal_Mean	Valence_SD	Arousal_SD	Category
2525	人生沒法假設，我沒法假設如果我吐的嚴重心情會怎樣，我只知道如何在自己現有的狀況下，儘可能保持樂觀態度，這是我希望在這裡分享的。	6.571	3.714	0.495	1.03	news
1045	「好萊塢報導」指出，今天公佈的倫敦影評人協會獎，臺灣導演李安擊敗同樣入圍奧斯卡金像獎最佳導演的奧地利導演麥可漢內克，贏得年度最佳導演獎。	6.714	6.167	0.7	0.687	news
138	想到故宮的烏鴉都有了歡喜的感覺.	6.250	4.333	0.968	0.943	book
1781	政黨就是理念的結合，華人世界既然只剩下這兩個政黨還相信理智及科學，與我理念相符，那麼我只好支持他們了。	6.125	4.333	0.599	0.943	political
2695	107年度綜合所得稅申報31日最後1天，據統計，利用電子申報的民眾已超過6成，到稅務單位元現場利用人工申報的民眾明顯減少，作業過程也順暢許多。	6.375	4.000	0.484	0.577	news
1652	他說，然而馬英九當年提出「六三三」，也勝選贏得總統，代表人民對他所拋出經濟成長的政策有很高的期待，所以如今纔有這麼大的失望。	2.889	5.778	0.737	0.916	political
191	索居，就是渴望內心的精神自由。	5.667	4.778	0.816	0.786	book
2751	泰國國王瓦吉拉隆功本月4日舉行加冕大典，66歲的他在加冕之前迎娶了第4任妻子蘇提妲，整個泰國沉浸在隆重的喜慶當中。	6.429	5.286	0.495	1.278	news
1407	他說，他們害怕失去獨立性，不想住進專門機構，覺得「沒有值得活下去的理由」；儘管他和父母曾力勸，但最終還是接受弟弟求死的心願。	3.286	4.875	0.452	1.364	news
2105	有媒體報道稱，5月11日，廣西柳州一中學在家長會上推出華為學生定製手機，該款手機可過濾不良資訊，並對使用時間進行管理。	6.167	3.286	0.687	1.278	news
767	攜程定的酒店房間價格比較貴，我到北京後朋友說他定的價格比我便宜100元，而且還含早餐。	4.875	3.556	1.536	1.165	hotel
1339	刮刮樂，問店家要如何對獎？洪月娥一對，興奮地告訴他「刮中頭獎三百萬元！	7.333	7.875	1.414	1.269	news
2965	不甩貿易戰，中國製造2025迫在眉梢，百年德國企業西門子看到中國正進行一場工廠智慧化的速度與規模之戰，要用AI和雲端搶先在中國轉型大戰中卡位搶先機。	5.111	3.111	0.737	1.912	news
1119	有人則說臺灣失去了一股正義力量，請各位網友默哀三分鐘。	2.875	5.857	0.599	0.639	news
2548	華為遭到Google切斷服務，未來新手機不能使用Google的相關應用程式App，包括Gmail、YouTube等都無法使用，重挫該公司在全球的佈局。	2.286	5.667	0.7	0.943	news
1315	臺北暗殺星在賽前並未被寄以厚望，但是卻連續擊敗世界排名第三的南韓NaJinSword、排名第二的俄羅斯Moscow5，以及排名第一的AzubuFrost，獲得冠軍絕無僥倖。	6.125	5.714	1.166	1.161	news
2132	惠普筆記本近年來得到了長足的發展，在增強設計審美、改善效能輸出、優化電池續航之外，還大膽使用皮革、木質來滿足消費者的不同需求。	6.222	3.333	0.916	1.414	news
1223	很多時候，男方在發生性關係前，或發生時會信誓旦旦說：「我會負責的」，「妳放心，我會照顧妳」。	3.625	6.000	0.484	0.756	news
1484	結果12局上老虎隊掌握契機，先是Cabrera遭保送上壘，接下來Young再打出超前的二壘安打攻下1分，AndyDirks也打出直擊投手的強襲球，DavidPhelps空手想接球卻無法順利完成出局數，讓老虎隊再下一城。	5.333	4.833	0.816	0.687	news
1344	在偶像劇《我可能不會愛你》爆紅的法鬥犬「包子」，最近在網路上又受到網友熱烈討論，但內容卻是對飼主的批評謾罵。	3.375	4.667	0.484	0.667	news
335	看了太多的爭論了但ToyotaAltis的銷量真的很可觀，我對它沒有偏見，可惜的是太多人開了，幾乎滿街都是...如果可以稀有點，也是台不錯的靚車...題外話，買賣就是願打願挨，所以安全性、油耗有的沒有的考量都在個人，我想是沒什麼好爭的，真的要爭取的是薪水吧?	4.111	5.375	1.37	0.484	car
1410	易吉益公司楊輝雄以「海浪發電裝置」及「可降解性包裝材之製作方法」獲最佳能源發明與最佳發明兩獎項，是最大贏家。	7.556	6.143	0.956	1.125	news
1011	優秀的外觀，輕薄的分量，完美的性能。	6.375	5.375	0.696	1.409	laptop
1292	誰是世界上最強的召喚師？臺灣的臺北暗殺星（ＴＰＡ）隊，將於臺灣時間十四日早上十點與韓國隊Azubufrost在電玩英雄聯盟第二季世界錦標賽一決雌雄，誰拿下總冠軍，就有百萬美元（約三千萬元臺幣）入袋。	6.571	5.429	0.495	1.05	news
597	瀑布寒……從來沒見過這麼方便的，要是小偷，哈哈，肯定笑死了。	6.222	5.667	0.916	1.333	hotel
971	這個筆記本性能好的，適合女生用，而且是粉色！	7.000	6.286	0.0	0.7	laptop
1473	總統強調，臺灣有最勤奮的人民，人民有最善良的心，相信只要大家互相扶持、互相鼓勵、互相包容，沒有衝不破的難關。	6.375	4.625	0.696	0.992	news
312	只要能讓我安全回到家，抱抱小王子，與女王說說情話！	5.857	4.778	0.639	1.227	car
2100	自本月的IPO以來，Uber的股價大幅下跌，從上上週四每股45美元的IPO發行價跌至上週二的38美元。	3.000	5.375	0.707	0.857	news
1920	金韓鬆還提到他的室友是利比亞人，「在利比亞爆發革命期間回到家鄉，發現那裏完全變成了另一個利比亞。	3.900	4.778	0.831	0.786	political
443	首先謝謝大家的回覆，讓我多了一項的知識起初我也想回toyota廠更換，不過報價真的太貴了。	5.125	5.750	0.781	0.661	car
2481	Facebook今天上午宣佈了一項新計劃，專注於利用其資料和技術幫助從事公共衛生工作的非營利組織和大學更好地繪製全球傳染病的傳播圖。	6.333	3.889	0.471	1.595	news
400	建議是~又不是沒有其他更好的選擇....只能祝福各位購入的車主以上，沒有別的不好的意思，單存個人意見一個看不慣這樣欺負台灣消費著的人	4.000	4.429	1.612	1.178	car
1328	甫獲2012紐倫堡國際發明展銀牌獎殊榮的明道大學材料系吳信達助理教授，又拿下準世界發明家獎「化學發明獎章」。	6.375	4.857	0.857	1.807	news
1099	高市青山行善團張團長透過裡長訪視，發現個案急需援助，網路號召網友幫忙，邀集紫霄帝闕玄天上帝廟合力捐款，發放白米、罐頭等物資。	6.250	4.625	0.829	0.696	news
1180	畢業典禮那天，我故意扣住他的畢業證書，他媽媽來找我，懇談了很久，兩個人談到抱頭痛哭，卻對孩子的拒絕學習一籌莫展。	3.444	6.714	0.831	0.7	news
1242	手銬不斷敲打，試圖用強大的撞擊力讓手銬鬆脫，就這樣東敲西打一通，手銬總算順利解開，侯姓男子開心的直向警方道謝，直說以後再也不敢亂玩手銬了。	5.000	5.167	0.0	0.687	news
2052	雖然微信的功能開放比較剋制，不過微信支付的協力廠商服務卻動不動搞個小動作，目前協力廠商服務已經多達12個，比騰訊自家的9個服務還要多。	5.000	4.250	0.756	1.561	news
1170	在遊戲中殺氣十足，但被外國媒體問到要如何使用獎金時，Bebe卻害羞地說不出話，最後還是MiSTakE把他「想買電視」的心願說出來；身型魁梧的Lilballz說，回到臺灣第一件事就是要好好享受臺灣美食。	5.857	4.857	0.639	0.833	news
2057	在螢光幕前綻放光芒、在女權運動裡暢所欲言，但在現實生活中，這位Dior香水的靈感繆思其實出身自一個不完美家庭。	4.714	3.667	0.7	1.826	news
2950	在比利時北部安特衛普市的特斯拉Supercharger超級充電站，一輛特斯拉ModelS著火併完全燒燬。	2.875	5.875	0.781	0.927	news
1175	反觀臺灣遊戲界，網友也紛紛替得獎選手打抱不平。	3.889	5.286	0.737	0.7	news
2861	我們可以在自己的業務中看到Google廣告的效果有多好，而我們只是坐在那裡吮著大拇指，所以我們感到羞愧。	3.556	5.500	0.831	1.225	news
1442	詹惟中分析周傑倫蛇年戀愛運旺，但孕事將不如心願，可能要到馬年才能播種成功；昆淩則是愛情、事業運皆不錯，若抓住周媽的心，將遠離感情危機。	5.444	4.625	0.497	1.317	news
572	感謝您的點評，並期待您的再次光臨！	6.375	4.778	0.484	1.03	hotel
789	"我是第三次入住了，但是給這家賓館留言還是第一次，這次入住我的一位朋友喝醉了，走到大廳我朋友就""現場直播""了~~~~~呵呵"	5.222	4.750	0.916	1.09	hotel
2650	日前一名阮姓老翁慌慌張張地走進萬華分局漢中街派出所，稱其中午前往郵局刷存摺後，便忘記與老婆約定會合的地點，希望警方給予協助。	4.100	4.333	0.831	1.333	news
1359	少女和死神拔河，一個禮拜後還是不幸死亡，她的媽媽心痛哽咽，眼眶滿是淚水，傷心的吳媽媽崩潰了，拿出女兒照片，原本漂亮可愛的女兒，再也回不來了。	1.800	7.667	0.872	1.155	news
683	聽朋友說那裏的小姐比較宰客，談好的價錢只是臺費，最後還會另收天價小費，不給的話，會有雞頭進來跟你談，挺恐怖的，最好不要嘗試。	2.556	4.750	1.257	1.392	hotel
933	然而這一過程往往容易產生龐大安全性漏洞，讓外界攻擊變得更加容易。	3.500	3.833	0.5	0.687	laptop
1717	「今天在這裏，必須要感謝20年前與我結婚的女子。	6.857	7.429	0.639	1.4	political
7	兩代人之間的鴻溝在優美的文字中慢慢地彌合，讓我回味、思考了很多。	6.400	4.571	0.49	1.05	book
1802	條款提案人、民主黨參議員韋伯表示，條款強化美日同盟的重要性，是美國支持亞太地區重要盟國強有力的表態。	5.250	4.429	0.433	1.4	political
2281	畢竟是自己選擇的路，走得不順、走得顛簸，也就是自己的責任，再也無法任性地說──做這些事情又不是我樂意的。	4.500	5.571	1.893	2.06	news
1003	昨天京東總部自提的，額滴神啊，很滿意。	6.125	4.833	0.781	1.344	laptop
2114	湖南衛視當家主持人汪涵、新聲代小花李莎旻子共同主持一場陣容豪華的直播界狂歡夜，將人們的視線和思緒又拉回到曾經繁華無限卻又落入沉寂的直播行業。	5.000	4.333	0.632	1.106	news
2393	這款簽字筆的筆桿材質為金屬，書寫粗細為0.5mm，筆芯顏色為黑色，使用方面，亮黑麗雅烤漆，光滑明亮，磨砂質感，觸感柔和。	6.500	3.400	1.025	2.059	news
1046	李安在奧斯卡獎頒獎前一壯聲色。	5.444	4.286	0.497	0.881	news
518	真的，主、被動再強，還是駕駛人的觀念最重要，不然也不會有名人的高級車或超跑...等的撞車新聞了，雖然都沒大礙，但開T牌的，撞車就一定會死人，是嗎?	3.700	6.000	0.9	0.707	car
72	正如Miki所說的“有些書，不必有那麼重大的意義”。	5.111	4.000	0.567	1.069	book
2638	澳洲DJAdamNeat4日和朋友在印尼峇裡島度假，未料卻傳出失血過多身亡的意外，公司也在5號在臉書上證實了這項訊息，讓粉絲相當痛心。	3.000	5.111	0.775	0.994	news
2112	5月27日，由映客直播主辦的映客527星光夜年度盛典在北京鑽石球場隆重舉行，當晚不僅有數百位映客人氣主播盛裝亮相，還有當紅明星實力助陣。	6.333	4.750	0.471	1.09	news
475	我猜應該60-95km/h以下我開小v快二年了當初是因為想省點油錢...小v在100km/h大概2800-2900轉左右110km/h大概3000轉起步大約3000轉就會換檔拉回了市區一般行駛時大概都在2000轉上下建議不要跑太快耗油加上不安全....尤其下雨天高速公路有積水的話超刺激100km/h過小水波區會瞬間空轉降速到快90km/h說另外個人平均油耗冬天不開冷氣)13.5-14左右夏天開冷氣12.5-13左右結論是台外型還不錯的省油小車優點)隔音差到爆是我覺得最討厭的缺點)	3.444	4.857	0.956	0.639	car
1404	佛貝森兄弟安樂死案獨特之處在於，兩人都非末期病患，身體也未受痛苦。	4.444	3.857	0.831	1.355	news
1014	散熱我相當滿意，也很安靜。	6.750	6.143	0.661	0.639	laptop
2285	初步調查顯示，女童沒有接種今季季節性流感疫苗，潛伏期內沒有外遊，她的弟弟最近出現發燒，已經求醫，無須入院，情況穩定。	5.556	3.125	1.066	0.927	news
2818	SuviKo甜甜的浪漫心意~京東秋迪食品專營店目前售價58元，領取29元優惠券，使用優惠券，券後實付僅需29元包郵。	5.714	4.833	0.7	1.462	news
639	房間寬敞舒服，硬體設施不錯。	6.444	4.111	0.497	0.875	hotel
631	趕緊走人換到了陽光酒店.	4.000	4.750	0.894	1.09	hotel
2213	然而，對於發行商來說，這些服務似乎真的是有利可圖的，EA剛剛宣佈，依靠這些服務，公司在2018/2019財年的第四和最後一個季度實現了強勁增長。	6.889	4.000	0.875	1.944	news
896	貢獻下驅動地址	5.000	1.000	0.0	0.0	laptop
1387	有趣的是，現場還臨時上演一段粉絲見面會，陳美鳳也熱情迴應，給予庇護員工「愛的抱抱」。	6.125	4.286	0.599	1.485	news
2698	2019亞洲身心障礙桌球錦標賽，7月將在靜宜大學舉行，傳出經費還沒有著落，擔任臺中市身障體育總會理事長的議員陳清龍，業務質詢時，批評運動局罔顧身障者運動權。	3.444	5.889	0.497	1.595	news
512	真的!!不怕死的就買TOYOTA;安全配備極差，開船上路還亂開的不少，要小心被撞~怕死的就買FOCUS;版金好	3.500	5.333	0.866	1.563	car
2299	持續脫水，尿液少、不易排出體內廢物，就可能形成結石或泌尿道感染；同時腎臟血量減少，血液變濃稠，氧氣及營養的供給停滯，也會損害腎臟細胞	3.000	3.778	0.707	1.75	news
86	我決定把這本書借她看看，讓她覺悟，讓她陰暗的心裏面重見陽光。	6.444	5.875	0.831	0.927	book
1939	並稱施亞努太皇是中國人民的老朋友，同中國幾代領導人，都有深厚的友誼，對中柬關繫有重大貢獻。	5.778	5.000	0.916	0.707	political
1411	帶隊的中華創新發明學會秘書長吳智堯說，易吉益利用生活中食材廢棄品製成可分解的包裝物材，具環境生態保護概念，獲得大會青睞。	6.556	5.000	0.497	0.632	news
807	我只說說缺點，拿到手後發現風扇發出很尖銳的高頻聲音，安靜的時候很是不爽。	3.000	6.375	0.0	1.218	hotel
2207	升級貿易摩擦不符合兩國人民和世界人民的利益，中方對此深表遺憾，如果美方關稅措施付諸實施，中方將不得不採取必要反制措施。	3.714	4.667	0.452	1.333	news
136	這本書倒挺適合那些做選擇時前思後想的女孩閱讀。	5.778	3.625	0.786	1.409	book
452	安全與否，眾說紛紜，你之所以提出TOYOTA不安全的疑慮，就要給個建議性的解答，回文沒有必要避重就輕，不然你提出的疑慮就白費了....你跟我說等有一天你能買車時，我真的笑了..小弟很早就買車了，開的車也不怕你知道，九年前買的TOYOTAVX-4	4.625	4.571	0.484	1.294	car
747	最近我和幾個朋友自駕游去揚州，經朋友介紹住在新世紀，第一感覺停車場特別大，可以同時停放約300--400輛車.	5.444	4.625	0.497	0.992	hotel
441	和泰今年EPS應該超過13元	5.750	5.556	0.829	0.956	car
2233	華為也將在遵守適用的法律法規基礎上，一如既往地積極參與到相關標準與產業組織中，通過不懈貢獻，與客戶和夥伴一起，構建良性健康、公平開放、可持續發展的產業生態。	5.875	2.875	0.781	1.364	news
2208	四月下旬，在這條原本平坦的道路上發生了一次事故，當時對龍號載人飛船的一次測試導致了爆炸，並且讓龍號載人飛船完全損毀。	3.000	5.300	0.816	1.847	news
876	3：完美屏，反應速度很快，機器整體功能還在測試。	5.889	4.714	0.737	1.278	laptop
1376	針對江母死因，地檢署昨委請前刑事警察局法醫研究所主任石開平相驗，解剖遺體後發現江母脖子上有不明顯勒痕，窒息死亡無誤。	3.286	3.125	0.452	1.269	news
2353	最新訊息是，這名瘋狂的半癱瘓男子已經駕駛著自己的PolarisRZR，成功地在探索頻道的見證下完成了這項挑戰。	6.429	4.250	0.495	2.278	news
881	鍵盤手感極好，打字噪音小。	6.667	4.444	0.667	1.165	laptop
1951	阿富汗母親：「我們沒有足夠食物，有時候孩子什麼都沒得吃，如果我丈夫有工作，就可以有食物，如果沒有，大家都得捱餓。	2.875	5.000	0.781	0.816	political
376	我覺得你們這些再說人家派工讀生也很好笑...哪一點讓你知道他是工讀生?	3.333	6.571	1.155	0.495	car
1069	自開航以來，從內部員工安全教育、導入新科技作業系統，到落實航機維修、地勤作業及飛行操作，以確保飛安品質。	5.778	4.000	0.629	0.926	news
2961	美國的網路安全業者PaloAltoNetworks近日宣佈已與兩家業者簽署併購協議，一是專精於容器安全的Twistlock，另一為無伺服器運算安全業	5.250	3.222	0.433	1.931	news
2412	其實這不是一個非黑即白的世界，所以我很難用潛規則和黑幕這樣的形容詞來表達一些現象，但是很願意寫一些令車主們費解卻又客觀存在的事實。	4.875	4.286	0.599	1.161	news
678	試想一下，當夜已很深，你正準備入眠的時候	4.889	5.000	0.314	0.756	hotel
1267	有些寵物友善餐廳就跟可以帶小孩去玩去叫的「親子餐廳」一樣，放任自家寶貝在室內亂跑，然後惹毛別家的寶貝還要說「哇！	3.143	5.143	0.99	0.833	news
2347	正方形相紙無須剪裁、方便直接列印社群媒體如Instagram相片，亦適合製作賀卡或裝飾物，照片貼紙可以隨意裁切至不同尺寸及多種有趣造型。	5.667	4.667	0.471	0.943	news
2907	就算從最現實短淺的角度來看，臺灣已經從貿易戰中獲得直接的好處了；更不用說，MIT將成為臺灣年輕人的絕佳機會！	6.750	4.500	0.829	2.121	news
894	全鍵盤帶數字鍵的顯卡足夠強大.	6.556	5.500	0.497	0.5	laptop
2669	他出席廉署第七屆國際會議致辭時表示，建立一個廉潔及公義的社會，香港視廉潔及法治為極度重要的基本價值，是香港繼續成為國際大都市的基石。	6.333	3.000	0.816	1.414	news
1015	顯示效果好，很白很透亮。	6.625	4.500	0.484	1.118	laptop
703	與之前的評價不符，a距離春圓海鮮廣場沒那麼近．b樓下的金鳳凰廣場也沒有想的那麼好．總之：下回不會在選擇了，還不如花少錢住三亞灣的小型度假村或花同樣的錢住環境好的亞龍灣	3.143	4.571	0.35	0.904	hotel
2640	然而在上個月，哥斯大黎加的一個小鎮上空卻出現了一個潮溼宇宙粘土，它在空中裂開並落下一種罕見的隕石碎片。	5.000	5.556	0.0	1.707	news
2411	本文要指出，林岱樺版大致合憲、符合公投甚至合乎同志的利益、立場及處境──雖然提案者的主觀意圖重點不在此。	5.222	3.111	0.416	1.792	news
2816	據聯合國釋出的報告表示，大部分虛擬助手的聲音都是有著年輕女性的特質，這加劇了女性即使在被粗魯對待也仍然是溫順、能滿足需要的刻板印象。	3.571	5.167	0.495	0.373	news
1728	中國共產黨十八屆一中全會昨天閉幕，第五代領導人由習近平接棒，國民黨主席馬英九立即致發賀電，向習近平表達祝賀，期盼兩岸強化互信、真誠合作以因應新的挑戰，並創造更多和平紅利，造福兩岸人民。	6.444	5.250	0.497	0.661	political
2325	習近平在賀電中表示，值此陛下加冕之際，我謹代表中國政府和中國人民，並以我個人的名義，向你和泰國人民致以誠摯的祝賀和良好的祝願。	6.667	4.500	0.471	0.957	news
2394	蔡司高品質鏡片，適合高度近視，鏡框任選~天貓祥和視界眼鏡專營店兩片售價1185元，值友可領取685元優惠券，享受到手價500元2片，喜歡的值友不要錯過。	6.111	4.111	0.737	1.853	news
1944	後因健康問題長期僑居北京接受治療。	4.100	4.500	0.831	1.118	political
488	平常熱血的我看到跑車玩drift或powerslide偶爾也會覺得挖~好酷!!..我也要努力賺錢!!可是這次看完影片我個人只覺得........	4.333	4.889	1.247	1.286	car
434	打一下那種的感覺，會覺得全身都麻了的，如果大多的話，可能會震死吧！	4.000	5.500	0.943	0.957	car
2582	看圖說故事對人類來說輕而易舉，但是對電腦而言看到一張影像能夠描繪其物件、場景與動作則需要靠電腦視覺、自然語言處理、深度學習等多種技術的匯集。	5.333	3.000	0.667	1.563	news
2722	我童年挺快樂，父母和睦家庭優渥，朋友對我挺好，我學習成績也挺好，唯一的煩惱可能就是中午食堂自己最愛吃的小炒肉又放了香菜。	5.429	3.556	0.495	1.343	news
2615	谷歌原生Android系統提供乾淨無懈可擊的使用者體驗和更快的更新，但與此同時，它缺少可螢幕滾動截圖等基本功能。	4.571	3.714	0.495	1.278	news
2326	近日，一則辦理去美國的簽證時，居然要上報自己的QQ和微博賬號給美國政府審查的訊息在網路上熱傳，並引起了一些中國網民的擔心，是不是以後不能隨便批評美國了。	3.167	5.833	0.373	0.687	news
222	她長大，總能在合適的時候給所愛的女人最好的愛護，雖然很多時候他們並不能見面，甚至連話都說不上，但心底的那個角落永遠	4.714	3.875	0.7	0.781	book
1020	螢幕15.4的，寬屏16：10看電影不錯內存一個G鍵盤我就不說了，IBM的鍵盤是世界公認手感和質量最好的硬盤250G，我一般是下載的480p的mkv格式的電影，一部電影也就1.5GB左右，哈哈，這個硬盤裝了一百多部電影是綽綽有餘的CUP是雙核的1.6G主頻，雖然是比較低端的賽揚系列，但是只要不是運算大型的專業軟件什麼的，同酷睿、奔騰的差距是基本區分不出來的	5.500	3.375	0.5	0.992	laptop
2093	值得注意的是這裡的平臺並不是指汽車底座的金屬結構，而是涵蓋了汽車的電子基礎，完全專注於為汽車提供現代連線的佈線和元件。	5.000	2.000	0.0	1.414	news
1127	總統馬英九今天發表除夕談話，除許下3個願望，也要大家放心，新的1年裏，「我們的經濟、我們的生活，一定會更好。	6.333	4.429	0.816	1.917	news
2332	為保障使用者自由選擇權，兩部門在通知中要求運營商嚴禁限制老使用者選擇新套餐等行為，切實增強使用者獲得感。	5.625	4.000	0.857	1.118	news
1371	許文雄於民國98年間因涉及職棒放水打假球案，不僅遭球隊開除，面臨沒有球打的失業困境，還被法院判決必須賠償原所屬球隊違約金新臺幣100萬元。	3.500	4.625	1.025	1.111	news
1776	有不同意見的媒體，沒有批判我的言論自由。	4.625	3.857	0.857	0.833	political
287	凡走過必留痕跡，在T版大聲說安全才重要的，有些還不是為了一些小毛病、小異音、小路感...等，要求原廠處理，如果真這麼在乎安全，又還必在乎其它東西	3.333	6.000	0.471	0.816	car
1088	兒盟表示，偏鄉弱勢孩子不僅吃不好、穿不暖、生活貧困，學習貧窮的狀況更令人擔心，包括學習資源、學習能力和學習機會也都相對貧窮，這樣的情況令人憂心，也擔心這些孩子的未來會陷入繼續貧窮的循環。	3.444	5.375	1.066	1.111	news
268	對於那些聰明的女子來說，更是一個完美的人生嚮導適合珍藏及細讀的一本書!推薦	6.778	5.600	0.629	0.49	book
2875	江西上饒市10日發生一起校園凶殺案，一名學生家長持刀衝進教室，衝著一名劉姓學生猛捅13刀，在場學生目睹行兇過程都被嚇呆。	1.714	7.857	0.881	1.125	news
1249	潘振強還指出，在釣魚臺問題上，美國含糊的態度，鼓勵了日本右傾勢力，「美國不要做得太過火，如果中日發生衝突，美國人的日子是很難過的。	4.000	4.857	1.054	1.884	news
2953	委內瑞拉緊繃局勢持續升高，委內瑞拉邊境爆發槍響，連結委國和哥倫比亞的西蒙玻利瓦爾國際大橋的附近道路槍聲大作，當時企圖跨越邊境的委國民眾全嚇得到處躲避。	3.000	6.714	0.756	1.278	news
1700	剛開完一整天的會，好不容易抽空上來看了一下	5.143	4.625	0.35	0.857	political
2768	從輪迴轉世的角度來看，人世就如一個巨大的舞臺，人們反覆地登臺退場，在舞臺上演繹著悲歡離合、愛恨情仇，平衡著各自的相欠，同時學習各種經驗和教訓。	5.571	4.000	0.495	1.414	news
2096	前不久，一位女子利用7天無理由退貨等服務規定，天天穿名牌新衣服，然後再申請退貨的事情在網上鬧得沸沸揚揚。	3.556	5.000	0.497	0.943	news
1400	反對加入歐盟的在野黨社會黨預期，和平獎將引發改組諾貝爾委員會的辯論。	4.625	4.889	0.484	0.314	news
516	如果因為2.5的稅金還有一些優勢不存，再加上很多安全配備被削減而導致銷量驟減。	4.000	4.571	0.0	1.05	car
817	酒店的設施極端簡陋，洗手間裏連浴簾都沒有，洗個澡滿屋子的水！	2.625	6.250	0.484	1.561	hotel
